Name,Rating,Pricing,URL,Latitude,Longitude,Transactions,Location,Phone,Display Phone,Distance,Reviews,Review Count,Cuisine,Restaurant ID,Number of Reviews
Eataly NYC Flatiron,5,$$,https://www.yelp.com/biz/eataly-nyc-flatiron-new-york-3?adjust_creative=YOPxpPg1qGggP5qGSctmew&utm_campaign=yelp_api_v3&utm_medium=api_v3_business_search&utm_source=YOPxpPg1qGggP5qGSctmew,40.74200824886595,-73.98993910744127,"['delivery', 'pickup']","200 5th Ave, New York, NY 10010",+12122292560,(212) 229-2560,3974.209291739669,"[{'text': 'Return visit for two of the four of us. \n\nWe had to have some more gelato and we have course came around lunchtime. We chose three different precautions for...', 'reviewer': 'Brian G.', 'reviewer_id': 'b8eNqpZFpAcjsokK-xWQww', 'rating': 5}, {'text': ""It wasn't busy in late afternoon of Sunday. I wanted to eat at Eatary for a while but didn't have the right chance to come so I fix it out I'm just popping..."", 'reviewer': 'Chunjai K.', 'reviewer_id': 'lloH0WufxlWFtFiq5M2P7g', 'rating': 3}, {'text': 'I think this place is the cats pajamas. The market as well as the restaurants are fucking insane! \nThe market has really quality imported stuff. Olive oil...', 'reviewer': 'James S.', 'reviewer_id': 'PWzYRUcI48HAZqivkA14Pg', 'rating': 5}]",3,"I, t, a, l, i, a, n",a0IET3_yCFcO36OqGSsisg,6044
Kebaya,3,,https://www.yelp.com/biz/kebaya-new-york?adjust_creative=YOPxpPg1qGggP5qGSctmew&utm_campaign=yelp_api_v3&utm_medium=api_v3_business_search&utm_source=YOPxpPg1qGggP5qGSctmew,40.737259886794405,-73.99120666086674,['restaurant_reservation'],"20 E 17th St, New York, NY 10003",+12126410401,(212) 641-0401,3493.1958094868405,"[{'text': 'Tried this on a Wednesday night and easily got a table. The restaurant was a little less than half full, street parking was relatively easy to find on a...', 'reviewer': 'Jessalyn S.', 'reviewer_id': 'JcyVDuY061gyTgMqKUlpeA', 'rating': 5}, {'text': 'This passes the Peranakan test, as attested by actual Peranakans I dined with.\n\nFirst off, I detest Laut. I went there before they got their Michelin star...', 'reviewer': 'Josephine L.', 'reviewer_id': 's16-BUo-orUsELvMu5ocKg', 'rating': 4}, {'text': 'Having been to both Laut and Singapura, I had high hopes for Kebaya being it was by the same chef. Unfortunately I was a bit disappointed. The food was good...', 'reviewer': 'Winston G.', 'reviewer_id': 'qb4l3B1VifNbkGkC61emSA', 'rating': 3}]",3,"M, a, l, a, y, s, i, a, n",vEvOcLuD99EMWJghbc_9ag,12
Macao Trading Company,5,$$$,https://www.yelp.com/biz/macao-trading-company-new-york?adjust_creative=YOPxpPg1qGggP5qGSctmew&utm_campaign=yelp_api_v3&utm_medium=api_v3_business_search&utm_source=YOPxpPg1qGggP5qGSctmew,40.719623,-74.003904,"['delivery', 'pickup']","311 Church St, New York, NY 10013",+12124318642,(212) 431-8642,2516.622649940654,"[{'text': '- excellent drinks\n- excellent service\n- excellent food\n\nOverall, solid venue for drinks with friends or dinner. Always a great experience here.', 'reviewer': 'Albert K.', 'reviewer_id': 'sILEA5_pp6-wrV2NOhcx0Q', 'rating': 5}, {'text': 'Ordered:\nShrimp & Scallion Dumplings (~$15 each): 1 fried & 1 steamed\nDozen Oysters (~$48): with leche de tigre mignonette\nMushroom Croquettes (~$16): with...', 'reviewer': 'Aya E.', 'reviewer_id': '6cBZYz36SYI1g0cYBYsteA', 'rating': 4}, {'text': 'Delicious meal and exciting experience at Macao. Came here with a friend for dinner, everything was exceptional!\n\nWe loved our meal---service was...', 'reviewer': 'Whitney L.', 'reviewer_id': '-j4ckp5yezUzJWieXl0TFQ', 'rating': 5}]",3,"A, s, i, a, n,  , F, u, s, i, o, n",U74_3F7r3tMhd6dmTmDBxQ,844
Monkey Bar,2,,https://www.yelp.com/biz/monkey-bar-new-york-4?adjust_creative=YOPxpPg1qGggP5qGSctmew&utm_campaign=yelp_api_v3&utm_medium=api_v3_business_search&utm_source=YOPxpPg1qGggP5qGSctmew,40.75998,-73.97313,[],"60 E 54th St, New York, NY 10022",+12124040365,(212) 404-0365,5872.310929865297,"[{'text': ""What an amazing experience I had at Monkey Bar for my anniversary! Everything exceeded my expectations.\n\nThe restaurant is hard to find if you're not..."", 'reviewer': 'Olivia P.', 'reviewer_id': '7ngFvy8_44rkVA2jd01mRg', 'rating': 5}, {'text': ""Truly a classic New York institution and it's been almost a decade since I've dined here, when I first moved to NYC. They've redecorated, but a lot of what..."", 'reviewer': 'Shu Jin S.', 'reviewer_id': 'UFcsAMlBDCOXz2iGvU7j9A', 'rating': 4}, {'text': 'This Monkey Bar x Hogsalt was quite a disappointment.\n\nMenu was almost copied from 4Charles and Au Cheval but done poorly.\n\n*Crispy Potato Pancake w/ Smoked...', 'reviewer': 'Emi B.', 'reviewer_id': '3lODYQrvcGriv5Fc2JdPOQ', 'rating': 2}]",3,"A, m, e, r, i, c, a, n,  , (, T, r, a, d, i, t, i, o, n, a, l, )",gZz9A8k8ORC_xl0aHxtY4w,57
H&H Reserve,4,,https://www.yelp.com/biz/h-and-h-reserve-brooklyn?adjust_creative=YOPxpPg1qGggP5qGSctmew&utm_campaign=yelp_api_v3&utm_medium=api_v3_business_search&utm_source=YOPxpPg1qGggP5qGSctmew,40.714232,-73.951424,[],"519 Metropolitan Ave, Brooklyn, NY 11211",+18458363039,(845) 836-3039,2442.497023607387,"[{'text': ""Saw that a new bar & food spot opened up here and was excited for the possibility of chili cheese (really miss Tommy's chili cheese from LA) and decided to..."", 'reviewer': 'Shoba P.', 'reviewer_id': 'P20IK-MVavUQqMBTK1i_NQ', 'rating': 5}, {'text': 'Came here for lunch at 1:30 on a Thursday and was very pleased with the food and the service. The schnitzel sandwich is delicious and is of a large portion...', 'reviewer': 'James S.', 'reviewer_id': 'kJnbLIPdJ6QOu_USBdfuZA', 'rating': 4}, {'text': ""I was sad to learn that the former neighborhood staple Sugarburg was closing. I didn't know why and it seemed that it happened out of no where! Regardless,..."", 'reviewer': 'Nicholas C.', 'reviewer_id': 'X4Cfxum1Jo0M3aENcqkt0Q', 'rating': 4}]",3,"S, a, n, d, w, i, c, h, e, s",qACLF23emO2Mfz3HbiiNWg,5
Henry's End,3,$$$,https://www.yelp.com/biz/henrys-end-brooklyn-4?adjust_creative=YOPxpPg1qGggP5qGSctmew&utm_campaign=yelp_api_v3&utm_medium=api_v3_business_search&utm_source=YOPxpPg1qGggP5qGSctmew,40.6987126,-73.99263839731027,['delivery'],"72 Henry St, Brooklyn, NY 11201",+17188341776,(718) 834-1776,1496.6064495591913,"[{'text': 'Excellent food, friendly, professional service and neighborhood gem. Never a bad meal; especially good the game specials and Mrs Mud Pie dessert.', 'reviewer': 'Terry W.', 'reviewer_id': '2wOLGSwJPLJP-wZuvvCOOw', 'rating': 5}, {'text': ""I went here a few weeks back having originally wanted to go to nearby Inga's but they were closed as some of the staff members had Covid so I stopped here...."", 'reviewer': 'Glenn C.', 'reviewer_id': 'JPH-WOKa6EBMlpBGLIPuiw', 'rating': 4}, {'text': 'so overrated. I lived in new york for 13 years and came here twice. the food is so overpriced and isnt even that good. When i saw my bill i nearly fainted....', 'reviewer': 'Patrick J.', 'reviewer_id': 'gyT1psYeysxjf_OaAQ9V0A', 'rating': 3}]",3,"A, m, e, r, i, c, a, n,  , (, N, e, w, )",xhuDOqY9G5mPuSqBnMCaYw,383
Kettl,4,,https://www.yelp.com/biz/kettl-brooklyn-3?adjust_creative=YOPxpPg1qGggP5qGSctmew&utm_campaign=yelp_api_v3&utm_medium=api_v3_business_search&utm_source=YOPxpPg1qGggP5qGSctmew,40.7296233,-73.95814229999999,[],"70 Greenpoint Ave, Brooklyn, NY 11222",+13477628142,(347) 762-8142,3041.692030194125,"[{'text': ""I came for the sundae, but they didn't have it when I went. I settled for a hojicha latte and matcha ganache tart, and both were so good.\n\nThe hojicha latte..."", 'reviewer': 'Samantha D.', 'reviewer_id': 'bIC3B9ODGU0afnfxMIdNtQ', 'rating': 5}, {'text': 'Lattes were good but we were really put off by the service. This place was highly recommended to us so we decided to stop in one cold afternoon. We were the...', 'reviewer': 'J R.', 'reviewer_id': '_XwQUuWet-VKEYLgaEO00w', 'rating': 3}, {'text': 'The weather on Saturday afternoon was pleasant, so I decided to grab a matcha latte and walk around Greenpoint. Kettl is a few minutes away from the G...', 'reviewer': 'Tiffany L.', 'reviewer_id': 'ed6glKJ-M3trlPdXofA4ew', 'rating': 4}]",3,"T, e, a,  , R, o, o, m, s",xuAtvWwGXfWGnxYK5hYvZg,38
Heno Heno,1,,https://www.yelp.com/biz/heno-heno-new-york-2?adjust_creative=YOPxpPg1qGggP5qGSctmew&utm_campaign=yelp_api_v3&utm_medium=api_v3_business_search&utm_source=YOPxpPg1qGggP5qGSctmew,40.7605197,-73.99011170000001,"['delivery', 'pickup']","358 W 46th St, New York, NY 10036",+16463988008,(646) 398-8008,5997.185853399979,"[{'text': 'Back to try more items on the menu. For the price to quality ratio, this place is awesome.\n\nCame on a rainy Friday night and there were plenty of seats.', 'reviewer': 'Leah W.', 'reviewer_id': '8C_878g8t7Gy23T2PffHvw', 'rating': 5}, {'text': ""The wow factors are the curry rice and Monkfish Liver. The curry is very thick, and creamy, and has beefy flavor even though there's no meat chunks in it...."", 'reviewer': 'Naixin C.', 'reviewer_id': '279khs2tdIFXDj0jZRdGTg', 'rating': 4}, {'text': 'I was looking for izakaya or family style Japanese restaurant then I found Heno Heno. I was excited to see the option recommended. \nUpon arrival there were...', 'reviewer': 'Maggie L.', 'reviewer_id': '0jX7F7zLdfpctNMOyyV-Pg', 'rating': 1}]",3,"I, z, a, k, a, y, a",cT48RskMO_o35Ua0tlifyQ,64
Osamil,5,$$,https://www.yelp.com/biz/osamil-new-york?adjust_creative=YOPxpPg1qGggP5qGSctmew&utm_campaign=yelp_api_v3&utm_medium=api_v3_business_search&utm_source=YOPxpPg1qGggP5qGSctmew,40.74697,-73.9864,['delivery'],"5 West 31st St, New York, NY 10001",+12123004713,(212) 300-4713,4460.064475681607,"[{'text': ""I can't believe it's taken me so long to write this review! I've been to Osamil a few times now and have left full and happy each time. I've never had a bad..."", 'reviewer': 'Lori P.', 'reviewer_id': '8Leqcqs14AyUeS47aqYXkA', 'rating': 5}, {'text': ""The ambiance is sexy and aesthetically pleasing. There were a lot of people and it was hustling and bustling. \n\nThe food was okay - I didn't love the..."", 'reviewer': 'Phoebe K.', 'reviewer_id': 'nUuLNRwOpCwqWBGgWRVFdA', 'rating': 3}, {'text': ""If you're a foodie, this is your jam. They have an ever-changing menu but at the time I had visited they were known for their pork shank and whole chicken...."", 'reviewer': 'Jack L.', 'reviewer_id': 'bM1jMFJp2T7RvVfVp4GmrQ', 'rating': 5}]",3,"K, o, r, e, a, n",X8yEmEDD9ZTkHoIRFqzcRw,626
Udon Lab,4,$$,https://www.yelp.com/biz/udon-lab-new-york?adjust_creative=YOPxpPg1qGggP5qGSctmew&utm_campaign=yelp_api_v3&utm_medium=api_v3_business_search&utm_source=YOPxpPg1qGggP5qGSctmew,40.7482036287177,-73.9874565,"['delivery', 'pickup']","43 W 32nd St, New York, NY 10001",+16468385338,(646) 838-5338,4609.574465614535,"[{'text': 'Nice ambiance, and the plain udon noodle paired with pork katsu on the side was exactly what I was looking for.', 'reviewer': 'Zulena S.', 'reviewer_id': 'Bt4CAyBEQZ1AIwQ5UF6-QQ', 'rating': 5}, {'text': 'I went there twice for lunch time. Food was awesome and dining room is clean and well decorated. I will definitely go back', 'reviewer': 'Chacattapol Y.', 'reviewer_id': 'EZMNIX0xR-Kh3KFL4hMagA', 'rating': 5}, {'text': 'We made reservations for a party of 3 at 12:30 on Saturday and were promptly seated. We each ordered Beef Niku Udon ($20) and shared Takoyaki ($11). They...', 'reviewer': 'Judy L.', 'reviewer_id': '4pCLAHH-z6hZl_9q-4_UAg', 'rating': 4}]",3,"N, o, o, d, l, e, s",kjItczuC-FQa-nECT9VF8A,365
Mr Mista Oh,4,$$,https://www.yelp.com/biz/mr-mista-oh-new-york?adjust_creative=YOPxpPg1qGggP5qGSctmew&utm_campaign=yelp_api_v3&utm_medium=api_v3_business_search&utm_source=YOPxpPg1qGggP5qGSctmew,40.74324,-73.99123,"['delivery', 'pickup']","41 W 24th St, New York, NY 10010",+16465598858,(646) 559-8858,4136.8613937036625,"[{'text': 'This is a hidden gem a outside of ktown. I had a reservation for a party of 18 on a Saturday night. We were seated immediately! We were so shocked that a...', 'reviewer': 'Michelle T.', 'reviewer_id': 'V0W4lIeJaxrU9vZyo2lpXA', 'rating': 5}, {'text': 'Came here as a large group on a Saturday. We made a reservation for 18 the morning of and was able to move it 30 minutes later during prime dinner times....', 'reviewer': 'Thomas M.', 'reviewer_id': 'fWATWxYFBn8BcEBdHQsZKw', 'rating': 2}, {'text': 'Came here with colleagues during lunch time. Each of us got some soup which comes with bowl of rice and some small appetizers like kimchi, broccoli, fish...', 'reviewer': 'Shengyu G.', 'reviewer_id': 'VzrUrJSJNnZeRNVxhmRCXg', 'rating': 4}]",3,"K, o, r, e, a, n",md5mjDamLsh1uxHDU9PfGA,165
Baba's Pierogies,5,$$,https://www.yelp.com/biz/babas-pierogies-brooklyn?adjust_creative=YOPxpPg1qGggP5qGSctmew&utm_campaign=yelp_api_v3&utm_medium=api_v3_business_search&utm_source=YOPxpPg1qGggP5qGSctmew,40.67687,-73.98633,"['delivery', 'pickup']","295 3rd Ave, Brooklyn, NY 11215",+17182220777,(718) 222-0777,3439.00531479571,"[{'text': ""My friend and I were eating our way through the neighborhood on a Thursday night and we started off at Baba's. The restaurant is bright and modern, very..."", 'reviewer': 'Edward K.', 'reviewer_id': 'PmRu3ZtMpGFJPn59Td0p9Q', 'rating': 5}, {'text': 'Food: warm, hearty, and filling. What more can you ask for? These pierogis are the epitome of comfort food. They are pillows of cheesy, carby goodness. Each...', 'reviewer': 'Kathleen X.', 'reviewer_id': 'U4FZThoCjSgWnuDF7aI9rA', 'rating': 4}, {'text': ""Very appreciative of having this gem in the neighborhood! I've eaten many pierogis in my lifetime, and also made some myself. This place just makes the best..."", 'reviewer': 'Andrea M.', 'reviewer_id': 'YquzaRcjDqROuR-mSyjz8w', 'rating': 5}]",3,"M, o, d, e, r, n,  , E, u, r, o, p, e, a, n",eIbKiQuExi12NcGeqMzQAw,464
Eataly NYC Flatiron,5,$$,https://www.yelp.com/biz/eataly-nyc-flatiron-new-york-3?adjust_creative=YOPxpPg1qGggP5qGSctmew&utm_campaign=yelp_api_v3&utm_medium=api_v3_business_search&utm_source=YOPxpPg1qGggP5qGSctmew,40.74200824886595,-73.98993910744127,"['delivery', 'pickup']","200 5th Ave, New York, NY 10010",+12122292560,(212) 229-2560,3974.209291739669,"[{'text': 'Return visit for two of the four of us. \n\nWe had to have some more gelato and we have course came around lunchtime. We chose three different precautions for...', 'reviewer': 'Brian G.', 'reviewer_id': 'b8eNqpZFpAcjsokK-xWQww', 'rating': 5}, {'text': ""It wasn't busy in late afternoon of Sunday. I wanted to eat at Eatary for a while but didn't have the right chance to come so I fix it out I'm just popping..."", 'reviewer': 'Chunjai K.', 'reviewer_id': 'lloH0WufxlWFtFiq5M2P7g', 'rating': 3}, {'text': 'I think this place is the cats pajamas. The market as well as the restaurants are fucking insane! \nThe market has really quality imported stuff. Olive oil...', 'reviewer': 'James S.', 'reviewer_id': 'PWzYRUcI48HAZqivkA14Pg', 'rating': 5}]",3,"I, t, a, l, i, a, n",a0IET3_yCFcO36OqGSsisg,6044
Chino Grande,5,,https://www.yelp.com/biz/chino-grande-brooklyn-2?adjust_creative=YOPxpPg1qGggP5qGSctmew&utm_campaign=yelp_api_v3&utm_medium=api_v3_business_search&utm_source=YOPxpPg1qGggP5qGSctmew,40.71350664203596,-73.95855296810493,[],"253 Grand St, Brooklyn, NY 11211",+19179090466,(917) 909-0466,1852.0461909838637,"[{'text': 'This place never disappoints. The fried rice was a tad salty. The eggplant skewer was delish for me but too sweet for hubs. The mussels and mushrooms were...', 'reviewer': 'Beezer C.', 'reviewer_id': '4Czvx0dhTDIAevFqijbg7g', 'rating': 5}, {'text': ""TLDR: I've been multiple times and every time the food slaps. Worth it just for the food but karaoke is the cherry on top of the cake!\n\nSETTING: nice large..."", 'reviewer': 'Elizabeth H.', 'reviewer_id': 'DaObW_AsgMgKOPISQvoLbw', 'rating': 5}, {'text': ""Love this place!! NGL i was a little apprehensive not knowing what to expect from the menu but wow was I pleasantly surprised!\nI'm actually still thinking..."", 'reviewer': 'Dana D.', 'reviewer_id': 'Z98jT6lXRMvX-CPiopKXTQ', 'rating': 5}]",3,"A, m, e, r, i, c, a, n,  , (, N, e, w, )",XQiIGgSjx3wIxvvzOZP9Cw,23
Amici Ristorante,5,$$,https://www.yelp.com/biz/amici-ristorante-new-york-3?adjust_creative=YOPxpPg1qGggP5qGSctmew&utm_campaign=yelp_api_v3&utm_medium=api_v3_business_search&utm_source=YOPxpPg1qGggP5qGSctmew,40.71981,-73.99722,"['delivery', 'pickup']","165 Mulberry St, New York, NY 10013",+12122032766,(212) 203-2766,2093.6811543697045,"[{'text': 'I was super hungry, looking for a place to eat and found this place.\nThe food was relatively ok, the pizza tasted like pizza hut pizza and the spaghetti...', 'reviewer': 'Schweppes C.', 'reviewer_id': '4TWb7MbcGtRcxJnzamHk2w', 'rating': 3}, {'text': 'Out of all the luring Italian restaurants in the area this one should stick out among the rest. The appetizers arent overlooked and put to the side. They...', 'reviewer': 'Flight Sim C.', 'reviewer_id': 't5lLZouX8dowbdSLQnaNsw', 'rating': 5}, {'text': 'Wowzers, just really tasty Italian food! Definitely worth it (calories and cost). \n\nHaving been to Italy several times, both my husband and I are picky...', 'reviewer': 'Eva D.', 'reviewer_id': '59dFqPOV9zESwE3RLH6zuw', 'rating': 5}]",3,"I, t, a, l, i, a, n",ZamvzoxEKiJEboO0ZUdogw,180
NAYA - Brooklyn Commons,5,,https://www.yelp.com/biz/naya-brooklyn-commons-brooklyn?adjust_creative=YOPxpPg1qGggP5qGSctmew&utm_campaign=yelp_api_v3&utm_medium=api_v3_business_search&utm_source=YOPxpPg1qGggP5qGSctmew,40.694001929623546,-73.98495549543546,"['delivery', 'pickup']","15 MetroTech Ctr, Brooklyn, NY 11201",+17187500589,(718) 750-0589,1559.1852513214635,"[{'text': ""Came here for lunch and wouldn't hesitate stopping by again. I'm a big fan of Cava and this place is similar. I ordered the Chicken Shawarma Bowl and it was..."", 'reviewer': 'Kiara P.', 'reviewer_id': 'uuPFjysy5g7LB9mIs-ZFNw', 'rating': 5}, {'text': 'I have seen this restaurant and heard about it but, this was my first time trying it. The fast casual Mediterranean place had a similar vibe and setup to...', 'reviewer': 'Andie B.', 'reviewer_id': 'Mu82DRjCMPxBdfaXW8a-tg', 'rating': 4}, {'text': 'I got put on to this place and it is my new go-to. The shawarma wrap is delicious and so so filling. Meat is seasoned well and succulent. The sauces and...', 'reviewer': 'Reema S.', 'reviewer_id': '9Bdo27Y4U7Y6Vy3c98hvyA', 'rating': 5}]",3,"L, e, b, a, n, e, s, e",l_BiOLZXNcV5HVWeDwXN4g,14
Aska,2,$$$$,https://www.yelp.com/biz/aska-brooklyn-3?adjust_creative=YOPxpPg1qGggP5qGSctmew&utm_campaign=yelp_api_v3&utm_medium=api_v3_business_search&utm_source=YOPxpPg1qGggP5qGSctmew,40.71226,-73.96641,[],"47 South 5th St, Brooklyn, NY 11249",+19293376792,(929) 337-6792,1191.9306437666935,"[{'text': ""Dining environment: \n\nDelicious index: \n\nMy sister and I said that my friend's store is very good, so I just came to try it when I was free. A 15 course..."", 'reviewer': 'Yingchun J.', 'reviewer_id': 'V94pVVNBlfLqho-JMeIMAg', 'rating': 5}, {'text': 'Just exquisite... I think out of all the fine dining meals I have had in NYC, this is up there near the top. The chefs here treated all the ingredients with...', 'reviewer': 'Mike Z.', 'reviewer_id': '2is-VOUj68KdySsQCGWQkg', 'rating': 5}, {'text': ""The food was good and the chef was great, but I went with 3 of my friends (all girls) and had the most bizarre, rude experience from who I'm assuming was..."", 'reviewer': 'Michelle R.', 'reviewer_id': 'ZqXLLaSigukbCm3P5wa5EQ', 'rating': 2}]",3,"S, c, a, n, d, i, n, a, v, i, a, n",UM3DuPsG6UKdmsC23O_Icw,142
Cornbread Brooklyn,5,$$,https://www.yelp.com/biz/cornbread-brooklyn-new-york?adjust_creative=YOPxpPg1qGggP5qGSctmew&utm_campaign=yelp_api_v3&utm_medium=api_v3_business_search&utm_source=YOPxpPg1qGggP5qGSctmew,40.6704,-73.95489,"['delivery', 'pickup']","409 Eastern Pkwy, New York, NY 11216",,,4572.458106800946,"[{'text': 'Food was excellent as always. \nMy server, Nia is very pleasant \nAnd service  me with a smile .', 'reviewer': 'Errol N.', 'reviewer_id': 'mjb0Kx4Ew2hA6eBUG1bOcw', 'rating': 5}, {'text': ""Beautiful!!! Blessed  . The food is Amazing!!! LaLa our server was Awesome!!! Thank You LaLa and All of The Staff!!! To The Chefs!!!! I Love Y'all"", 'reviewer': 'Lesley A.', 'reviewer_id': 'wg7fx7LuMtr_okbWrlEIDQ', 'rating': 5}, {'text': ""A lil pricey for my taste but to be honest it fits in PERFECTLY with the neighborhood. Since I moved out of Crown Heights it hasn't gotten anything but..."", 'reviewer': 'Christina M.', 'reviewer_id': '1pE3HaB3ufEp6HJpXDxgTw', 'rating': 5}]",3,"S, o, u, l,  , F, o, o, d",C3WY8BJBF-8GOujO7fasmg,211
Two Hands,4,,https://www.yelp.com/biz/two-hands-new-york-5?adjust_creative=YOPxpPg1qGggP5qGSctmew&utm_campaign=yelp_api_v3&utm_medium=api_v3_business_search&utm_source=YOPxpPg1qGggP5qGSctmew,40.726306014451026,-73.9956844,"['pickup', 'delivery']","74 Bleecker St, New York, NY 10012",+16466697183,(646) 669-7183,2546.1733882126355,"[{'text': 'Recently stopped by Two Hands for brunch and ordered the Smashed Avo Toast - \navocado, pickled shallots, pepitas, sesame seeds, and pickled chilies on...', 'reviewer': 'Kobsupang R.', 'reviewer_id': '7FoE5PH5CV6I6ZEfxVG5rg', 'rating': 5}, {'text': ""I had high hopes for this restaurant, but sadly I wasn't impressed. I love an Australian cafe so I was excited to try this out, but there wasn't really..."", 'reviewer': 'Ellen L.', 'reviewer_id': 'IcjPM9m9MHCDpkuwBXqvQA', 'rating': 3}, {'text': 'Solid place for brunch, although nothing too remarkable. I got their breakfast bowl which came with eggs, avocado, sweet potato, roasted tomato, beet...', 'reviewer': 'Joy Z.', 'reviewer_id': 'Wtwi0BUKkZTHREjPGanjGA', 'rating': 4}]",3,"C, a, f, e, s",_03n3VP-tujID_SJbeEDeA,65
Osteria Brooklyn,3,$$$,https://www.yelp.com/biz/osteria-brooklyn-brooklyn?adjust_creative=YOPxpPg1qGggP5qGSctmew&utm_campaign=yelp_api_v3&utm_medium=api_v3_business_search&utm_source=YOPxpPg1qGggP5qGSctmew,40.693154,-73.967177,"['delivery', 'pickup']","458 Myrtle Ave, Brooklyn, NY 11205",+16467509156,(646) 750-9156,1854.4655128746913,"[{'text': 'I recently visited an Italian restaurant that truly exceeded my expectations. From the moment I walked in, I was greeted with warm hospitality and the aroma...', 'reviewer': 'Doreen L.', 'reviewer_id': 'Dq_Jkpx4xpbh4iofayOr6g', 'rating': 5}, {'text': ""Food was amazing but the service was slow on Valentine's Day. \nReservation 730pm - left around 10:30pm\n\nI loved the jazz playlist they had on - i kept on..."", 'reviewer': 'Gertrude C.', 'reviewer_id': '7xn04phT5wK498Gaj73wqg', 'rating': 3}, {'text': ""I came here with my girlfriend for a Valentine's Day dinner. I wish I had known how severely unprepared and understaffed they would be. A lot of the wait..."", 'reviewer': 'Robert M.', 'reviewer_id': '42DAKnbcd3kJNNtGsRT1Iw', 'rating': 3}]",3,"I, t, a, l, i, a, n",4zw8vEJNc4mcHh2ARzj2gw,191
shabushabu Mayumon,4,,https://www.yelp.com/biz/shabushabu-mayumon-new-york-5?adjust_creative=YOPxpPg1qGggP5qGSctmew&utm_campaign=yelp_api_v3&utm_medium=api_v3_business_search&utm_source=YOPxpPg1qGggP5qGSctmew,40.71434,-73.99205,['restaurant_reservation'],"115 Division St, New York, NY 10002",+16464767717,(646) 476-7717,1352.1610407121225,"[{'text': 'Excellent! Loved the atmosphere, simplicity, and elegance of the small space. The food was excellent and the hostess pleasant and endearing.', 'reviewer': 'Jeff H.', 'reviewer_id': 'IwCGsf_kRwgjPhBvWaRMgQ', 'rating': 5}, {'text': 'Date of Visit: 12/6/2022\nShabushabu Mayumon is a fancy style of Japanese Shabu Shabu, with A5 Wagyu beef from Miyazaki and Washugyu, and also Pork Belly in...', 'reviewer': 'Michelle H.', 'reviewer_id': 'JnOgq2kqWeGeFMXLcZ4vAw', 'rating': 5}, {'text': 'Came in for the Wagu Shabu Shabu.\nWe had a reservation for the 2nd portion of the evening\nOverall high quality meats, excellent for meat lovers.\nIt was an...', 'reviewer': 'Lindsey D.', 'reviewer_id': 'rp8BECKOXsyWrwDvkso44g', 'rating': 4}]",3,"J, a, p, a, n, e, s, e",Pe4cQ65ZJ9qS8JQZVkJz4g,80
Ro’s Diner,5,,https://www.yelp.com/biz/ro-s-diner-brooklyn?adjust_creative=YOPxpPg1qGggP5qGSctmew&utm_campaign=yelp_api_v3&utm_medium=api_v3_business_search&utm_source=YOPxpPg1qGggP5qGSctmew,40.708458,-73.940886,"['delivery', 'pickup']","197 Meserole St, Brooklyn, NY 11206",+19179091665,(917) 909-1665,3209.482557803384,"[{'text': ""Formerly Champs, Ro's Diner is almost as good and cheaper, too! Same location, less decor, same black and white theme. Many options for brunch with kind..."", 'reviewer': 'Merry B.', 'reviewer_id': 'awmR81Syg9cBnK1PScOXPw', 'rating': 5}]",1,"D, i, n, e, r, s",IqD-JuRkP4_WMypm9kIkiA,1
Sunflower - Gramercy,3,$$,https://www.yelp.com/biz/sunflower-gramercy-new-york-3?adjust_creative=YOPxpPg1qGggP5qGSctmew&utm_campaign=yelp_api_v3&utm_medium=api_v3_business_search&utm_source=YOPxpPg1qGggP5qGSctmew,40.7399,-73.98219,"['delivery', 'pickup']","335 3rd Ave, New York, NY 10010",+19172620804,(917) 262-0804,3640.3358171387104,"[{'text': 'Yummy breakfast bowls - I replaced bacon with beyond sausage. \nThe boy had chicken and waffles and loved it. \nSmall place but worth the wait we had on...', 'reviewer': 'Claudia R.', 'reviewer_id': 'yhiHc_BwoU2kuOFdwwCdAg', 'rating': 5}, {'text': 'Sunflower Gramercy, more like Sunflower Catastrophe or maybe OneHour Grandmaspeed or maybe even Myserver Ranonme, or maybe Letdown Lordhavemercy\n\nI was very...', 'reviewer': 'Ashley P.', 'reviewer_id': '2PURk5LF8GG6i7lBPA6slQ', 'rating': 1}, {'text': 'Okay so let me say the food was delicious! My friend got the chicken and waffles, they were pricy ($28) but they tasted so good. The breakfast nachos I...', 'reviewer': 'Danielle M.', 'reviewer_id': 'NO2RPS5DJLKbepH2-EIaHQ', 'rating': 3}]",3,"B, r, e, a, k, f, a, s, t,  , &,  , B, r, u, n, c, h",zV1_EFMN4VY7Rxpv7P-ajg,329
