Name,Rating,Pricing,URL,Latitude,Longitude,Transactions,Location,Phone,Display Phone,Distance,Reviews,Review Count,Cuisine,Restaurant ID,Number of Reviews
Katsu-Hama,5,$$,https://www.yelp.com/biz/katsu-hama-new-york?adjust_creative=YOPxpPg1qGggP5qGSctmew&utm_campaign=yelp_api_v3&utm_medium=api_v3_business_search&utm_source=YOPxpPg1qGggP5qGSctmew,40.75638,-73.97759,"['pickup', 'delivery', 'restaurant_reservation']","11 E 47th St, New York, NY 10017",+12127585909,(212) 758-5909,5470.143110846729,"[{'text': ""Hands down the BEST katsu I've ever had! \n\nWe came for a late lunch around 3pm and waited for about 30 minutes before were sat down at the bar-like area...."", 'reviewer': 'Helen H.', 'reviewer_id': 'TXNkZG64mISWWv3tKRvMEA', 'rating': 5}, {'text': ""Great spot for some katsus! \n\nWe came in a little past 12nn on 3/18/23 and we were seated right away (there was only two of us\nFyi). It's slightly tight..."", 'reviewer': 'Kimberly T.', 'reviewer_id': 'aHDkI0NUbJ6EsbNC8Wm1kA', 'rating': 5}, {'text': 'I went around 6pm on a wednesday night with no reservation, luckily got seated immediately at the bar. By the end of the meal there was a line forming all...', 'reviewer': 'Shelley C.', 'reviewer_id': 'SP9RPoVPRQQJjr4AqmjLhg', 'rating': 5}]",3,"J, a, p, a, n, e, s, e",-J8VuX3wGrYSOBu2G0hMsw,1562
The Esters,5,,https://www.yelp.com/biz/the-esters-brooklyn?adjust_creative=YOPxpPg1qGggP5qGSctmew&utm_campaign=yelp_api_v3&utm_medium=api_v3_business_search&utm_source=YOPxpPg1qGggP5qGSctmew,40.72545,-73.94526,[],"192 Nassau Ave, Brooklyn, NY 11222",,,3480.7488592081513,"[{'text': 'I wish I lived in Brooklyn, because this is the perfect bar and we would come here regularly! My wife and I were on a brief trip to NYC and we stayed in...', 'reviewer': 'James E.', 'reviewer_id': 'hpaUzWcj9iJvYeU7zSLSKg', 'rating': 5}, {'text': 'Good corner bar with outdoor seating and cheese plates. \n\nMust watch minimum word count.', 'reviewer': 'Pizza S.', 'reviewer_id': 'ftP4ataZifZIqNYjJQ64Og', 'rating': 5}, {'text': ""This was a great spot to catch up with an old friend. It was quiet but the bar keep was friendly and the vibe was chill. I didn't order it but the pizza..."", 'reviewer': 'Lizzie D.', 'reviewer_id': 'tTzA9KodmnLuef2JH8zvqQ', 'rating': 5}]",3,"C, o, c, k, t, a, i, l,  , B, a, r, s",bQORrPVUnR4FyBUGuwugqQ,7
Egg Shop,4,$$,https://www.yelp.com/biz/egg-shop-new-york-3?adjust_creative=YOPxpPg1qGggP5qGSctmew&utm_campaign=yelp_api_v3&utm_medium=api_v3_business_search&utm_source=YOPxpPg1qGggP5qGSctmew,40.7204574688656,-73.9952510689421,"['pickup', 'delivery']","151 Elizabeth St, New York, NY 10012",+16466660810,(646) 666-0810,2012.2555261437674,"[{'text': ""When a friend picked this for a double date spot, I groaned inwardly. I'm not an egg person (blasphemous, I know), so a place that literally calls itself..."", 'reviewer': 'Josephine L.', 'reviewer_id': 's16-BUo-orUsELvMu5ocKg', 'rating': 4}, {'text': ""Food: Turkish eggs were simply delicious! Lavender coffee was eh, it's skippable. \n\nService: good, servers were very attentive. \n\nAmbiance: Nolita location..."", 'reviewer': 'Vibha S.', 'reviewer_id': 'nyyT9U33tRS2F2jNs5PRnQ', 'rating': 4}, {'text': ""Overall rating: 4.4\n\nLove the egg shop whenever I'm hungry for breakfast. Their bread/ buns is so soft. I can't remember what's pictures here but I remember..."", 'reviewer': 'Olivia N.', 'reviewer_id': 'uaAJzWR1iipChDerr_hFkg', 'rating': 4}]",3,"B, r, e, a, k, f, a, s, t,  , &,  , B, r, u, n, c, h",GlTdgd8780RNXLvz8bTmFg,1241
Osteria La Baia,2,,https://www.yelp.com/biz/osteria-la-baia-new-york?adjust_creative=YOPxpPg1qGggP5qGSctmew&utm_campaign=yelp_api_v3&utm_medium=api_v3_business_search&utm_source=YOPxpPg1qGggP5qGSctmew,40.76189587672743,-73.9806749,[],"129 W 52nd St, New York, NY 10019",+19176719898,(917) 671-9898,6077.410478924674,"[{'text': 'Highly recommend. \n\nYou walk in to a fabulous atmosphere. You are greeted by amazing staff who make your experience amazing. \n\nThe montepulciano wine is...', 'reviewer': 'Jason M.', 'reviewer_id': 'DjiTQpTqEfCiq2SkMFQWeg', 'rating': 5}, {'text': ""Ambiance is great and so is the food.  The reason for the 3 star review is more about how they made me feel.  It's a beautiful restaurant and the pricing is..."", 'reviewer': 'May L.', 'reviewer_id': 'IrTMIA65RznIRZZOkmQb5Q', 'rating': 3}, {'text': ""Came here on a weekend for a girl's night out in the city. Sadly, was left disappointed overall. For appetizers, we got the burrata and beef carpaccio. The..."", 'reviewer': 'Samantha W.', 'reviewer_id': 'iR_Ndioz2bL-PVB8BQd5uw', 'rating': 2}]",3,"I, t, a, l, i, a, n",OWNmOq-TAsHjGcYdCVclSw,74
Olmsted,1,$$$,https://www.yelp.com/biz/olmsted-brooklyn?adjust_creative=YOPxpPg1qGggP5qGSctmew&utm_campaign=yelp_api_v3&utm_medium=api_v3_business_search&utm_source=YOPxpPg1qGggP5qGSctmew,40.67713,-73.96869,"['pickup', 'delivery']","659 Vanderbilt Ave, Brooklyn, NY 11238",+17185522610,(718) 552-2610,3465.8285587001637,"[{'text': 'After wanting to try here for a while, we finally went for dinner last night. Excellent food, wine, and service. The three of us ordered 5 dishes and 2...', 'reviewer': 'Nicole H.', 'reviewer_id': '1LS5cHt2LS2Z8jQ1Voui-Q', 'rating': 5}, {'text': 'We went to Olmsted 2 years ago and were surprised by the tiny portions and high prices. It was during the pandemic and we thought it might just be a...', 'reviewer': 'Emily M.', 'reviewer_id': '7yPv7aq_pmRAJsXNco3Mmg', 'rating': 3}, {'text': ""This is a grift. The food is atrocious. It's made for pretentious hipsters who  are impressed by semi prepared Georgian food. \n\n16.00 for 4 butternut squash..."", 'reviewer': 'Queen R.', 'reviewer_id': '84lcVCz48xx5Jpfi4rB2Zg', 'rating': 1}]",3,"A, m, e, r, i, c, a, n,  , (, N, e, w, )",Ulr_Nyp2nvt82EPH_BiftA,474
Fat Fowl,4,,https://www.yelp.com/biz/fat-fowl-brooklyn?adjust_creative=YOPxpPg1qGggP5qGSctmew&utm_campaign=yelp_api_v3&utm_medium=api_v3_business_search&utm_source=YOPxpPg1qGggP5qGSctmew,40.6910061,-73.98295519999999,"['pickup', 'delivery']","445 Albee Sq W, Dekalb Market Hall, Brooklyn, NY 11201",,,1838.7004961787804,"[{'text': ""Fat Fowl is an awesome spot in Dekalb Market that is certain to appeal to all. They've got options for the carnivores and for the plant based squad. The..."", 'reviewer': 'Amara R.', 'reviewer_id': 'RVl4wNUwiOHN79rzvld5XA', 'rating': 5}, {'text': 'I really loved the dishes here and the concept of ""new age Caribbean cuisine. The food was quite good, it reminds me of the Caribbean version of Boston...', 'reviewer': 'Arielle D.', 'reviewer_id': 'nlWzLw7I8wehYoKhF5Yrag', 'rating': 4}, {'text': 'Came to grab some lunch on a day off and was pleased with the price and quality of lunch! I sat at the counter, ordered a glass bottle coke and dug into a...', 'reviewer': 'Caroline L.', 'reviewer_id': 'EpSJgwOcO9CN1Jh4ToC7OQ', 'rating': 4}]",3,"C, a, r, i, b, b, e, a, n",6gpx42BtqgUdyYe8y9DP4Q,53
Taiwanese Yummy,5,,https://www.yelp.com/biz/taiwanese-yummy-new-york?adjust_creative=YOPxpPg1qGggP5qGSctmew&utm_campaign=yelp_api_v3&utm_medium=api_v3_business_search&utm_source=YOPxpPg1qGggP5qGSctmew,40.713,-74.0072,[],"New York, NY 10007",,,2467.711291298591,"[{'text': 'I went to the Seventh Heaven street fair in Brooklyn, and to my surprise, there was a whole block dedicated to Taiwanese culture! It was right next to Japan...', 'reviewer': 'Kenny C.', 'reviewer_id': 'xJpvRrk04rb4rgWtMXaPUQ', 'rating': 5}, {'text': 'The popcorn chicken here is amazing! Transports me back to Taiwan! Very light and crispy with a savory dash of spices. \n\nThe gua bao was good too, though I...', 'reviewer': 'Wendy H.', 'reviewer_id': 'jzqLpVkB1rg9AssLKm7lvw', 'rating': 5}, {'text': ""This place is amazing! Hidden gem! If you happen to go to a fair or bazaar and find this stand, definitely give it a try, you won't be disappointed. The..."", 'reviewer': 'Los A.', 'reviewer_id': '6h7J5-NFzGv99g9bNn1_7Q', 'rating': 5}]",3,"T, a, i, w, a, n, e, s, e",6YxjANE2V7n8TehK79C9wg,3
7th Street Burger,4,,https://www.yelp.com/biz/7th-street-burger-new-york-9?adjust_creative=YOPxpPg1qGggP5qGSctmew&utm_campaign=yelp_api_v3&utm_medium=api_v3_business_search&utm_source=YOPxpPg1qGggP5qGSctmew,40.75238,-73.98939,"['pickup', 'delivery']","485 7th Ave, New York, NY 10018",,,5086.897239001858,"[{'text': ""Finally a solid grab and go burger joint has arrived walking distance from Penn Station and less than 2 blocks from my office. \n\nIn that area it's typically..."", 'reviewer': 'Andrew K.', 'reviewer_id': 'B84U6lanAqmupVluYpSpSQ', 'rating': 5}, {'text': ""There is something wonderful in the simplicity of a good meal or drink. You don't need to try and hide flavors, just simple presentation of good quality..."", 'reviewer': 'Richard S.', 'reviewer_id': 'rdxqBh7RncSiVAgwj-fFjA', 'rating': 4}, {'text': ""I've been to a couple different locations for burgers from this chain and this one is no different.\n\nThe impossible burger was tasty and satisfying as..."", 'reviewer': 'Christine H.', 'reviewer_id': 'u0x3SXagjYDbI2N4sgJ0Tw', 'rating': 4}]",3,"B, u, r, g, e, r, s",VVYea3NzbklOyHEzSEavWw,44
Clinton Hall - FiDi,4,$$,https://www.yelp.com/biz/clinton-hall-fidi-new-york?adjust_creative=YOPxpPg1qGggP5qGSctmew&utm_campaign=yelp_api_v3&utm_medium=api_v3_business_search&utm_source=YOPxpPg1qGggP5qGSctmew,40.70803,-74.014869,"['pickup', 'delivery']","90 Washington St, New York, NY 10006",+12123636000,(212) 363-6000,3031.3748047531735,"[{'text': 'A great place for drinks and bites with friends.  The service is always spot on and the outdoor space is massive.  The lemon pepper chicken fingers were...', 'reviewer': 'Marie A.', 'reviewer_id': '2IO_0p-QOU75s2m1rgbMcQ', 'rating': 5}, {'text': 'UGH. Zero stars. Simple take out / pickup order. Clearly just not being run efficiently. I called and they said order would ready in 20 mins. Showed up 20...', 'reviewer': 'Ahmed M.', 'reviewer_id': 'fRMYH7W9_EApxQdcDkAcHQ', 'rating': 1}, {'text': 'Beer garden- good for company bonding time! I went on a weekday after work and there seemed to be a lot of corporate people. The place was bustling with...', 'reviewer': 'Bellody C.', 'reviewer_id': 'm-34afplOJATE_-svc-dUw', 'rating': 4}]",3,"B, a, r, s",nm5rcWNmfevNXLNQAITi5w,758
Nabila’s,5,,https://www.yelp.com/biz/nabila-s-brooklyn-2?adjust_creative=YOPxpPg1qGggP5qGSctmew&utm_campaign=yelp_api_v3&utm_medium=api_v3_business_search&utm_source=YOPxpPg1qGggP5qGSctmew,40.68563884890456,-73.99459569999999,[],"248 Court St, Brooklyn, NY 11201",+13476899504,(347) 689-9504,2743.0903225250877,"[{'text': 'Really enjoyed our meal here last night. From the small bites to the entrees, everything was bursting with unique and delicious flavors. There were four of...', 'reviewer': 'John M.', 'reviewer_id': 'FkefgiGDSB1nc9r9jVAfNg', 'rating': 5}, {'text': 'Cozy Lebanese restaurant and cafe. Very homey feeling. Staff was welcoming and fun. \n\nWine and beer selection are simple and to the point. A few different...', 'reviewer': 'Joseph T.', 'reviewer_id': 'SqVUNVeYJblyoUz4e-Fiqw', 'rating': 4}, {'text': 'This is quite a unique place. The food is very good, and it is served in an informal and elegant way by a crow of young people. Everything is exposed in a...', 'reviewer': 'Pett O.', 'reviewer_id': 'v28DibiRxvd4sUuzm38YSw', 'rating': 5}]",3,"L, e, b, a, n, e, s, e",tvgvaUpOJ6OQv6edy-zAQw,19
Monarch Restaurant,5,$$,https://www.yelp.com/biz/monarch-restaurant-brooklyn?adjust_creative=YOPxpPg1qGggP5qGSctmew&utm_campaign=yelp_api_v3&utm_medium=api_v3_business_search&utm_source=YOPxpPg1qGggP5qGSctmew,40.715895,-73.962271,"['pickup', 'delivery']","146 Metropolitan Ave, Brooklyn, NY 11249",+19179091596,(917) 909-1596,1702.2703320785824,"[{'text': 'Phenomenal. Cocktails, service, ambience, music, but THE FOOD. So amazing. Perfect for omnivores but so fantastic are the vegan choices that you miss out on...', 'reviewer': 'Brooklyn H.', 'reviewer_id': 'IrgsNGPG2gYGg8bB5GmUOA', 'rating': 5}, {'text': ""A small group of friends joined me in celebrating my wife's birthday here and let me tell you that everyone was happy with the overall experience from..."", 'reviewer': 'Andy E.', 'reviewer_id': 'pyAyeua5ZrFrp_etVDMvwQ', 'rating': 5}, {'text': 'Cool restaurant with an innovative, flavorful, and surprisingly vegan-friendly menu!\n\nThe dinner experience: I was impressed that they had an entire...', 'reviewer': 'Lauren C.', 'reviewer_id': 'JNVGChHwcoVEL1cEd2wWtw', 'rating': 5}]",3,"P, a, n,  , A, s, i, a, n",jLhKLKuNPMTzAMJgEY5DsQ,114
La Chilaquería - New York,5,,https://www.yelp.com/biz/la-chilaquer%C3%ADa-new-york-new-york?adjust_creative=YOPxpPg1qGggP5qGSctmew&utm_campaign=yelp_api_v3&utm_medium=api_v3_business_search&utm_source=YOPxpPg1qGggP5qGSctmew,40.746995,-73.992207,[],"139 W 28th St, New York, NY 10001",+19173883823,(917) 388-3823,4554.431727772679,"[{'text': ""Don't be put off by the reviews that say the chilaquiles here are mostly chips. That's what chilaquiles is. It's like saying pizza is mostly dough. \n\nI had..."", 'reviewer': 'Michelle G.', 'reviewer_id': 'Xwnoa7MWIwSZbeM7HeJZ5g', 'rating': 5}, {'text': 'What a pleasant discovery in Chelsea! La Chilaqueria delivers tasty chilaquiles in a cute atmosphere. We ordered an order of the chilaquiles con chicharron...', 'reviewer': 'Jonathan M.', 'reviewer_id': 'Us7ijh6LFeXI46BnKX8lKQ', 'rating': 5}, {'text': ""Chilaquiles.....how I love my chilaquiles. I love 'em verde, I love 'em rojo, I love 'em divorciados. But, tragically, it has been hard to love 'em since we..."", 'reviewer': 'Elli S.', 'reviewer_id': '0AWlzCo0SSc1Uk1K9DudhQ', 'rating': 5}]",3,"M, e, x, i, c, a, n",IpBG_nY_opO9Zy-xNBEQCg,42
Yakiniku Toraji,5,,https://www.yelp.com/biz/yakiniku-toraji-new-york?adjust_creative=YOPxpPg1qGggP5qGSctmew&utm_campaign=yelp_api_v3&utm_medium=api_v3_business_search&utm_source=YOPxpPg1qGggP5qGSctmew,40.75105,-73.97278,[],"217 E 43rd St, Ste 1f, New York, NY 10017",+19294172629,(929) 417-2629,4944.410114589566,"[{'text': ""THE. BEST. Yakiniku in New York City!!! \n\nToraji's menu is a wonderful selection of the highest quality food and drink. The staff does a great job creating..."", 'reviewer': 'Calvin A.', 'reviewer_id': 'n32RRtdLgl_VlAi-WQiYSg', 'rating': 5}, {'text': 'Good meat, a bit on the pricier side but nice portions. \nLoved their appetizers and also soup. Tried the beef bone one I think, very good. \nDefinitely a one...', 'reviewer': 'Yumi I.', 'reviewer_id': '5oEnMMjKQGLWL5ttLD5RsA', 'rating': 5}, {'text': 'Booked this reservation through Open Table on a Sunday night and thoroughly enjoyed our date night here. We were seated in the area where you take off your...', 'reviewer': 'Michelle T.', 'reviewer_id': 'gC9lQsL6loYOYrfB4M4sHw', 'rating': 5}]",3,"B, a, r, b, e, q, u, e",Jx3xWeqYnyWOIhSlAlggTA,40
Fine & Rare,4,$$$,https://www.yelp.com/biz/fine-and-rare-new-york?adjust_creative=YOPxpPg1qGggP5qGSctmew&utm_campaign=yelp_api_v3&utm_medium=api_v3_business_search&utm_source=YOPxpPg1qGggP5qGSctmew,40.7501754760742,-73.9821929931641,"['pickup', 'delivery']","9 E 37th St, New York, NY 10016",+12127253866,(212) 725-3866,4779.73787683471,"[{'text': ""Fine and rare is a Restaurant like no other. My fiancé brought me to this restaurant for Valentine's Day a day earlier to avoid crowds, and I was treated to..."", 'reviewer': 'Vivi T.', 'reviewer_id': 'F7dM7h9apftjHuTaFVdesw', 'rating': 5}, {'text': 'We went here for a birthday dinner, and it did not disappoint! After looking through a handful of steakhouses in New York this was one that stuck out, the...', 'reviewer': 'Stefani M.', 'reviewer_id': 'VsIyusA8FKwYZUWkksK8Xg', 'rating': 5}, {'text': 'Awesome vibe with great music!\n\nThe decor in this place is chill and laid back.  The bar is a bit small, but cute....accommodating!\n\nIf you need to check...', 'reviewer': 'Kawone H.', 'reviewer_id': 'wWFcmX-19cIu0Vu2kHKttg', 'rating': 4}]",3,"A, m, e, r, i, c, a, n,  , (, N, e, w, )",Xk3BVvlX-KXh6kJhbClMKw,495
Win Son Bakery,3,$$,https://www.yelp.com/biz/win-son-bakery-brooklyn-9?adjust_creative=YOPxpPg1qGggP5qGSctmew&utm_campaign=yelp_api_v3&utm_medium=api_v3_business_search&utm_source=YOPxpPg1qGggP5qGSctmew,40.70721,-73.94302,['delivery'],"164 Graham Ave, Brooklyn, NY 11206",+19179091725,(917) 909-1725,3030.642589111285,"[{'text': 'The only words that come to mind: delicious, 10/10, amazing, perfect, I would give up my left kidney to experience this bakery for the first time...', 'reviewer': 'Jamie P.', 'reviewer_id': 'tnlHjSth777JjaJwPLF_Rw', 'rating': 5}, {'text': ""i REALLY wanted to like win son bakery. i've been craving taiwanese breakfast food for so long (specifically salty soy milk and fan tuan). \n\nwhile it was..."", 'reviewer': 'Jessalyn L.', 'reviewer_id': 'F-x9Oxq8hVo-KYQgYPpPQQ', 'rating': 3}, {'text': 'What warped social experiment did I wander into? Tv blasting with some bullshit occasionally cutting off to a 30 second playlist that played two snippets of...', 'reviewer': 'Clari B.', 'reviewer_id': 'LO_uLZ2ya4VC4JSXqzSFKA', 'rating': 3}]",3,"C, a, f, e, s",pYjMy5ixIeeG1YLEt4bGDg,307
Two Hands,5,$$,https://www.yelp.com/biz/two-hands-new-york-4?adjust_creative=YOPxpPg1qGggP5qGSctmew&utm_campaign=yelp_api_v3&utm_medium=api_v3_business_search&utm_source=YOPxpPg1qGggP5qGSctmew,40.71782,-74.00547,"['pickup', 'delivery']","251 Church St, New York, NY 10013",,,2523.5092756723593,"[{'text': 'This has become one of my favorite restaurants for brunch. All of the food is so good and a plus that it is healthy! The vibe very bright, clean and has a...', 'reviewer': 'Jeremy P.', 'reviewer_id': '-PJawVoTqTwksNQgf5kKTw', 'rating': 5}, {'text': 'I came here Sunday afternoon for brunch and I must say it was a cute spot. I really enjoyed my iced Cappachino and avacado toast with poached egg on top....', 'reviewer': 'Jessica P.', 'reviewer_id': '7C_GtfB63teEEuweTGQXRQ', 'rating': 3}, {'text': 'Fantastic ! \nService is great and food is delicious.\nOpen early and good vibe all day', 'reviewer': 'Igm G.', 'reviewer_id': '1s9SzLBMLbLuY8A1pkuk4A', 'rating': 5}]",3,"B, r, e, a, k, f, a, s, t,  , &,  , B, r, u, n, c, h",3cC6UcOj_-FMXRBYlsXFzA,365
The Malt House,3,$$,https://www.yelp.com/biz/the-malt-house-new-york-3?adjust_creative=YOPxpPg1qGggP5qGSctmew&utm_campaign=yelp_api_v3&utm_medium=api_v3_business_search&utm_source=YOPxpPg1qGggP5qGSctmew,40.709659,-74.009262,"['pickup', 'delivery']","9 Maiden Ln, New York, NY 10038",+16466827577,(646) 682-7577,2576.8995581610807,"[{'text': 'Came here with a group for lunch and had a great time. I like the décor and setup of the restaurant. You could seat a party of 7-8 comfortably. The menus is...', 'reviewer': 'Daniel J.', 'reviewer_id': 'wKwSrotTHEQn8YwQO6QyoA', 'rating': 5}, {'text': ""Had brunch here. Food was OK but had an experience that was tacky and left a really sour taste in my mouth.\n\nOrdered a coffee with my brunch. It wasn't on..."", 'reviewer': 'Ken L.', 'reviewer_id': 'Wq0xRuh2eecTrRx-kFtGtQ', 'rating': 1}, {'text': 'About a 2-2.5: The Malt House offers various American eats, such as appetizers (such as Marco Nacho, Pulled Pork Sliders, etc.), salads, pasta dishes (such...', 'reviewer': 'Hannah H.', 'reviewer_id': 'GHoG4X4FY8D8L563zzPX5w', 'rating': 3}]",3,"G, a, s, t, r, o, p, u, b, s",ohLIPmzTysowInbte9XhMw,606
Mercato,5,$$,https://www.yelp.com/biz/mercato-new-york?adjust_creative=YOPxpPg1qGggP5qGSctmew&utm_campaign=yelp_api_v3&utm_medium=api_v3_business_search&utm_source=YOPxpPg1qGggP5qGSctmew,40.75619,-73.9937,"['pickup', 'delivery']","352 W 39th St, New York, NY 10018",+12126432000,(212) 643-2000,5583.284372936722,"[{'text': ""I've eaten there in 2019.\nThe ambiance was simple but at the same time elegant. \n\nThe service was always professional & the food exceptional. \n\nTake out is..."", 'reviewer': 'Izzy N.', 'reviewer_id': '_kK4Sjes9hS0yeulGgEmGA', 'rating': 5}, {'text': 'Super cozy Italian eatery. Perfect for what we wanted in NYC for our visit ... Delicious, great quality food and atmosphere that was not going to break the...', 'reviewer': 'Bronwen K.', 'reviewer_id': '2mMBXjxJrHelz4hSWLNG5A', 'rating': 5}, {'text': ""I was a little hesitant to come to Mercato because I've been to some other highly rated Italian restaurants in NYC and not enjoyed it for the price point...."", 'reviewer': 'Caitlin C.', 'reviewer_id': 'JJfbw1fuzKgH009NRwRkUQ', 'rating': 5}]",3,"I, t, a, l, i, a, n",Ve6GVzzJpR5QIIPdcn6ViQ,1030
Do Not Disturb,4,,https://www.yelp.com/biz/do-not-disturb-new-york?adjust_creative=YOPxpPg1qGggP5qGSctmew&utm_campaign=yelp_api_v3&utm_medium=api_v3_business_search&utm_source=YOPxpPg1qGggP5qGSctmew,40.73771095155175,-74.0041054,[],"285 W 12th St, New York, NY 10014",+19179652271,(917) 965-2271,3996.516239470247,"[{'text': 'Was in the area late night with my friend and yelped for places that were open. Randomly selected DND, and boy, was I happy! We had no idea it was a speak...', 'reviewer': 'Tremaine R.', 'reviewer_id': 'QM_Irutg-UwxhFhyAyH0Sw', 'rating': 5}, {'text': ""It's going to be really hard to top this meal this year. I started the year off so strong with having this be one of my first stops in Jan!\n\nI could drag on..."", 'reviewer': 'Sarah P.', 'reviewer_id': 'PQRrKlyxZ8mJponoP8MU5Q', 'rating': 5}, {'text': '-overall rating: 3.5\n- nice cocktail bar but a few steps does not a speakeasy make\n- the cocktails are well balanced and well made, definitely the star of...', 'reviewer': 'Casey W.', 'reviewer_id': 'Pk5pWlKt7GkDUDtaSYb-NQ', 'rating': 4}]",3,"S, p, e, a, k, e, a, s, i, e, s",WoMVwgn3E265w37gAM4BRQ,26
Fukurou Brooklyn,5,,https://www.yelp.com/biz/fukurou-brooklyn-new-york-2?adjust_creative=YOPxpPg1qGggP5qGSctmew&utm_campaign=yelp_api_v3&utm_medium=api_v3_business_search&utm_source=YOPxpPg1qGggP5qGSctmew,40.70154,-73.92694,"['pickup', 'delivery']","105 Wilson Ave, New York, NY 11237",+13472401637,(347) 240-1637,4431.999089641348,"[{'text': 'Looking for a delicious Japanese ramen spot with a side of humor? Look no further than this gem of a restaurant. With its amazing appetizers, including...', 'reviewer': 'Eddie I.', 'reviewer_id': 'vteUMhAFHAxIo-vo9-rM1g', 'rating': 5}, {'text': ""Ordered from this place for delivery and I'm glad I did! Got the spicy tonkatsu and the takoyaki. \n\nThe ramen broth comes on the side in a separate..."", 'reviewer': 'Leilani S.', 'reviewer_id': 'ZZPsK3ePNV9DWHF5C2QqrA', 'rating': 4}, {'text': 'Despite living around the corner for nearly two years, I had never heard of Fukurou before! After a long trip back from Texas, I needed a good meal for...', 'reviewer': 'Kelsey B.', 'reviewer_id': '76fsP-c6ROQg9xAWSshN4Q', 'rating': 5}]",3,"R, a, m, e, n",O7b3WKYglyu_3lYxN7GXRQ,36
Tipsy Shanghai,2,$$,https://www.yelp.com/biz/tipsy-shanghai-new-york-2?adjust_creative=YOPxpPg1qGggP5qGSctmew&utm_campaign=yelp_api_v3&utm_medium=api_v3_business_search&utm_source=YOPxpPg1qGggP5qGSctmew,40.72929,-73.99882,"['pickup', 'delivery']","228 Thompson St, New York, NY 10012",+12127630877,(212) 763-0877,2963.2774809583866,"[{'text': ""The food in this ancient hole in the wall restaurant is fantastic. We didn't get a single thing that we didn't enjoy. The ribs were fabulous and the..."", 'reviewer': 'Avi R.', 'reviewer_id': 'o8VZERfw3dol4toZG4OSFg', 'rating': 5}, {'text': 'Looks like they have a few locations so must have something about it. The shumai were my jam. The pork ribs also was solid but not my favorite. The cold...', 'reviewer': 'Nicholas G.', 'reviewer_id': 'fExL6u06xTSg13k945IPAQ', 'rating': 4}, {'text': ""Came here on a Pulsd deal. I was hopeful about it but let down. \n\nThe restaurant didn't feel as clean as it should. The workers were a lot more touchy than..."", 'reviewer': 'Liz D.', 'reviewer_id': 'Lw1CvoHdDjWirTVSmfjM4g', 'rating': 2}]",3,"S, h, a, n, g, h, a, i, n, e, s, e",X4hEgOBOLTYFhlWO-gAFxQ,359
Karasu,4,$$$,https://www.yelp.com/biz/karasu-brooklyn-2?adjust_creative=YOPxpPg1qGggP5qGSctmew&utm_campaign=yelp_api_v3&utm_medium=api_v3_business_search&utm_source=YOPxpPg1qGggP5qGSctmew,40.68937279085807,-73.9732461,[],"166 Dekalb Ave, Walter's, Brooklyn, NY 11217",,,2045.301401232435,"[{'text': ""Karasu is good. It's located within Walter's in which you have to walk through the little diner to an inconspicuous location in the back. (10/10 on..."", 'reviewer': 'Wendy Z.', 'reviewer_id': 'XdWjk8VcqdGL4EVoGJ8VsA', 'rating': 4}, {'text': 'Overhyped and overrated wanna be speak easy bar in brooklyn.\nkaraage ?! size and taste similar to Popeyes Chicken. Also, $14 sweet potato wrap in tin...', 'reviewer': 'Mike B.', 'reviewer_id': '9JeVNnGK0AtpJ3tMFqRO5A', 'rating': 1}, {'text': ""Who doesn't love a restaurant within another restaurant? Friend recommended this gem and it was an amazing experience. \n\nAll the drinks were amazing and the..."", 'reviewer': 'Edward W.', 'reviewer_id': 'P4Td3m5oMGZGTfDVZzgztg', 'rating': 4}]",3,"J, a, p, a, n, e, s, e",eyjeP9CJZ_gYgeJFP_vtpQ,111
