Eric M.,/user_details?userid=pFktgSxZmmgy91_K2x4CWQ,"Oakland, CA",6/6/2019,5.0,"Absurdly good. Definitely the best Greek restaurant that I've been to in the city. The lamb dish (I don't remember what it was called) was crazy tender and delicious, and even better, they have an excellent traditional horiatiki salad (ie. what ""Greek salad"" is based on). I'll be visiting again and telling my friends.",https://www.yelp.com/biz/kikis-new-york?adjust_creative=YOPxpPg1qGggP5qGSctmew&utm_campaign=yelp_api_v3&utm_medium=api_v3_business_search&utm_source=YOPxpPg1qGggP5qGSctmew
Monica S.,/user_details?userid=8nnIFxDpaJdehjZYFK7nLw,"Manhattan, New York, NY",5/30/2017,3.0,"The food here is really good ,but that's about it. The price you have to pay for good food and decent prices is not always worth it if you want to enjoy a nice dinner out. It's always packed, so most of the time you must wait for a table ( not always the worst thing), which also means the place is quite loud ( again, not always the worst thing). In addition, the service is terrible.Most times I have been there the servers were surly hipsters, and popular items were just ""not available"" that night. For me, the annoying factors usually add up to another destination....after all, there are so many choices in this area.",https://www.yelp.com/biz/kikis-new-york?adjust_creative=YOPxpPg1qGggP5qGSctmew&utm_campaign=yelp_api_v3&utm_medium=api_v3_business_search&utm_source=YOPxpPg1qGggP5qGSctmew
Ella R.,/user_details?userid=R-j4LnmPopzZ6WcHx_nJdw,"New York, NY",1/8/2016,1.0,No comment,https://www.yelp.com/biz/kikis-new-york?adjust_creative=YOPxpPg1qGggP5qGSctmew&utm_campaign=yelp_api_v3&utm_medium=api_v3_business_search&utm_source=YOPxpPg1qGggP5qGSctmew
Joanie K.,/user_details?userid=pR4aCoE5lplAParShrBMiw,"Brooklyn, NY",7/17/2016,3.0,No comment,https://www.yelp.com/biz/kikis-new-york?adjust_creative=YOPxpPg1qGggP5qGSctmew&utm_campaign=yelp_api_v3&utm_medium=api_v3_business_search&utm_source=YOPxpPg1qGggP5qGSctmew
Ana V.,/user_details?userid=IWVvVV1H-bT0x8eezUod6w,"Manhattan, NY",5/3/2017,4.0,A little hard to find but food is really good! The place looks small at first but they have a larger dining room on the other side. We got the traditional Greek salad and the Mixed Grill for two. The salad was simple yet tasty and the mixed grill was very filling- we were not able to finish the fries. We also got to try some Greek sodas!,https://www.yelp.com/biz/kikis-new-york?adjust_creative=YOPxpPg1qGggP5qGSctmew&utm_campaign=yelp_api_v3&utm_medium=api_v3_business_search&utm_source=YOPxpPg1qGggP5qGSctmew
Valerie G.,/user_details?userid=r7GHYNcXMwCxd5SIHNBsAQ,"Montreal, Canada",11/23/2016,5.0,"Came in sat at the bar and ordered: 1 Horiatiki greek (no lettuce) salad and some Yigantes beans to share, One Pastitchio et one Moussaka both very good, the portions are quite generous and the price is fair. We were talked into ordering the dessert by some fellow bar diners called an Ekmek(sp),which I had never tried before.  It was really impressive and a bit difficult to describe,but I can tell you that I am not a big dessert person but this was light and airy, and just very satisfying,so add to list.  The decor is very cozy and the wait staff are professional and friendly.  A must try if your in the area or looking for some good reliable greek cuisine.",https://www.yelp.com/biz/kikis-new-york?adjust_creative=YOPxpPg1qGggP5qGSctmew&utm_campaign=yelp_api_v3&utm_medium=api_v3_business_search&utm_source=YOPxpPg1qGggP5qGSctmew
Hannah B.,/user_details?userid=DxZrVhSMJhY6fLqEnTqfEA,"New York, NY",9/11/2017,5.0,No comment,https://www.yelp.com/biz/kikis-new-york?adjust_creative=YOPxpPg1qGggP5qGSctmew&utm_campaign=yelp_api_v3&utm_medium=api_v3_business_search&utm_source=YOPxpPg1qGggP5qGSctmew
Al N.,/user_details?userid=K11YygGHT_4mjUpaYlHe_g,"Manhattan, New York, NY",6/28/2017,1.0,No comment,https://www.yelp.com/biz/kikis-new-york?adjust_creative=YOPxpPg1qGggP5qGSctmew&utm_campaign=yelp_api_v3&utm_medium=api_v3_business_search&utm_source=YOPxpPg1qGggP5qGSctmew
Alison M.,/user_details?userid=yIKWunivEyR0MmZIXWmDyA,"Washington, DC",8/4/2018,2.0,"So sad to be giving a bad review. The service was pretty awful but for the restaurant, it seemed standard. We did not see our waiter after we ordered. We had to literally walk away from the table to go get him and then inform him that 1) we wanted our check and 2) he forgot two of our dishes. Even after we tracked him down and informed him that he forgot multiple dishes, he was unapologetic and actually brash in his response. When you're going to a restaurant rated like Kiki's, you'd expect decent service or at least the waiter to treat you like a human being.",https://www.yelp.com/biz/kikis-new-york?adjust_creative=YOPxpPg1qGggP5qGSctmew&utm_campaign=yelp_api_v3&utm_medium=api_v3_business_search&utm_source=YOPxpPg1qGggP5qGSctmew
Vikash S.,/user_details?userid=U9BOAa32JoTVr2EwgSBagg,"Portland, ME",2/21/2017,5.0,"9/10: This is a gem of a Greek restaurant tucked away in a part of the LES that I rarely make it to. While the wait times can be long (and there is a reason for that!) we were able to find a seat at the bar within 15 mins. The service was casual but attentive and quick. The food arrived pretty quickly as well and everything that we ordered was great (the spinach pie was slightly dried out but still tasted delicious). The Greek salad and grilled octopus are a must. Great experience overall and one that won't break the bank, I'll definitely be back!",https://www.yelp.com/biz/kikis-new-york?adjust_creative=YOPxpPg1qGggP5qGSctmew&utm_campaign=yelp_api_v3&utm_medium=api_v3_business_search&utm_source=YOPxpPg1qGggP5qGSctmew
Tatiana T.,/user_details?userid=_9Fxk4uoypWAzsfOh1zQtw,"Houston, TX",8/27/2017,5.0,Cool staff! Awesome food. Come not starving cause it's a wait and they don't accept reservations.,https://www.yelp.com/biz/kikis-new-york?adjust_creative=YOPxpPg1qGggP5qGSctmew&utm_campaign=yelp_api_v3&utm_medium=api_v3_business_search&utm_source=YOPxpPg1qGggP5qGSctmew
Linda Z.,/user_details?userid=d1JhMG7-EwEIYdGUHv49RA,"Brooklyn, NY",7/16/2016,5.0,"I've visited Kiki's four times and am charmed by the food, people, and atmosphere every time. Kiki herself seats you at your table and greets you like you're a friend. The food arrives quickly and wait staff is always attentive. Party favorites that are always seen at my table: the roasted eggplant dip, grilled octopus, lemon potatoes and  classic Greek salad. Kiki's lifehack: forego a meat entree, order my favorites to share, and definitely get the cheesecake.",https://www.yelp.com/biz/kikis-new-york?adjust_creative=YOPxpPg1qGggP5qGSctmew&utm_campaign=yelp_api_v3&utm_medium=api_v3_business_search&utm_source=YOPxpPg1qGggP5qGSctmew
Michael C.,/user_details?userid=ebSrBDJJ-oBVWYt1h0PIQQ,"Manhattan, NY",11/8/2016,5.0,"Awesome place. Awesome Greek restaurant in Chinatown, who woulda thunk, LOL. Love how they left the Chinese shop signs outside. Wine list is affordable, with good selections. The food is delicious and they do not skimp in the servings. Staff is friendly.  The venue is deceptively large; the waits to be seated are not long.  They do not take reservations.",https://www.yelp.com/biz/kikis-new-york?adjust_creative=YOPxpPg1qGggP5qGSctmew&utm_campaign=yelp_api_v3&utm_medium=api_v3_business_search&utm_source=YOPxpPg1qGggP5qGSctmew
Romain G.,/user_details?userid=2eGTQeJ0pLmSZ6grRLznZA,"Manhattan, New York, NY",10/10/2017,4.0,"Finally went to Kiki's last Friday for dinner! The wait is a bummer: we were a large group of 8 people and were told we had to wait almost two hours. We went to wait in a bar nearby and they actually called us after just one hour. The food was fantastic, the service was great and super quick, it is not expensive, the place is cute and lively. I cant recommend it enough!",https://www.yelp.com/biz/kikis-new-york?adjust_creative=YOPxpPg1qGggP5qGSctmew&utm_campaign=yelp_api_v3&utm_medium=api_v3_business_search&utm_source=YOPxpPg1qGggP5qGSctmew
Eric G.,/user_details?userid=R7ocyD90NK6CDz_u7MwqPg,"Manhattan, NY",3/28/2017,5.0,"One of my favorite spots. Great food at a great price. Service is terrific. Can't wait to eat here again soon. I highly recommend this to everyone and anyone, but on second thought I take that back. Stay away from my favorite place.",https://www.yelp.com/biz/kikis-new-york?adjust_creative=YOPxpPg1qGggP5qGSctmew&utm_campaign=yelp_api_v3&utm_medium=api_v3_business_search&utm_source=YOPxpPg1qGggP5qGSctmew
Victoria A.,/user_details?userid=RQF_rsM6-K604e4cG4ViOg,"Jersey City, NJ",9/30/2017,5.0,"Kiki's. Is. Amazing. We came in at 7pm on a Friday so naturally the place was super busy, but we were sat right away. The vibe of the place is so trendy and open and airy! We had a pretty big group so we ordered a bunch to share and everything came out really fast. We got tyrokafteri, tzatziki and saganaki to start. Still thinking about the saganaki tbh. And then moussaka, pastitsio, and a mixed grill. I'd recommend every single thing. Moral of the story, go to Kiki's and order one of everything. Except the saganaki; get two of those.",https://www.yelp.com/biz/kikis-new-york?adjust_creative=YOPxpPg1qGggP5qGSctmew&utm_campaign=yelp_api_v3&utm_medium=api_v3_business_search&utm_source=YOPxpPg1qGggP5qGSctmew
Pee G.,/user_details?userid=clBWvVP0L7rtdu3TDP3z4Q,"Rancho Cordova, CA",3/11/2017,1.0,Would have been a perfect experience except for one exceptionally rude bitch. Curly hair short funky bun jacked mummy thin eyeliner looking to be tattooed on by someone else who found her rude as well. Food was ahhhhmazing! Restaurant dirty and small....All this can be overlooked.....Not rude service. Outwardly I hate my job rude. I payed 3 few as much at new waffle House by arena....Service was without parallel.,https://www.yelp.com/biz/kikis-new-york?adjust_creative=YOPxpPg1qGggP5qGSctmew&utm_campaign=yelp_api_v3&utm_medium=api_v3_business_search&utm_source=YOPxpPg1qGggP5qGSctmew
David C.,/user_details?userid=JHJC6BGcSG8Rm0bta_ICYA,"Brooklyn, NY",5/17/2016,5.0,"This place is sooooooo good! The food is delicious, the service is really amazing. Someone has to order the lamb chops when you go. They are incredible. The potatoes are too. I don't know what they have on them, but I was this close to rubbing them on my face. Incredible!",https://www.yelp.com/biz/kikis-new-york?adjust_creative=YOPxpPg1qGggP5qGSctmew&utm_campaign=yelp_api_v3&utm_medium=api_v3_business_search&utm_source=YOPxpPg1qGggP5qGSctmew
Gokce G.,/user_details?userid=xf7LnhSxfjA1_xP68vlvAQ,"New York, NY",1/12/2019,5.0,"Yeeees Kiki's!! I probably tried everything on the menu and its always 10/10! If it's your first time here you should definitely get the branzino with lemon potatoes on the side and of course the octopus, oooh that octopus! And the house red to go with it, and of course end your dinner with the famous cheesecake :) yes the line might be long but it is long for a reason, just go next door to grab a cocktail and you'll be seated before you know it!",https://www.yelp.com/biz/kikis-new-york?adjust_creative=YOPxpPg1qGggP5qGSctmew&utm_campaign=yelp_api_v3&utm_medium=api_v3_business_search&utm_source=YOPxpPg1qGggP5qGSctmew
Perry T.,/user_details?userid=A0YZSajDug67lG0NkW6i7A,"Manhattan, NY",10/17/2016,4.0,"I came here for a birthday dinner the other night and it was amazing! The space is very small and cramped, which makes it tough to navigate around the tables, but lends a fun and cozy atmosphere to the place. Our large group shared a bunch of dishes family style: horiatiki, tzatziki, hummus, octopus, spanakopita, chicken with potatoes, and lots of wine. Everything was very tasty - the spanakopita was my favorite! Surprisingly great for a large group, despite being very small.",https://www.yelp.com/biz/kikis-new-york?adjust_creative=YOPxpPg1qGggP5qGSctmew&utm_campaign=yelp_api_v3&utm_medium=api_v3_business_search&utm_source=YOPxpPg1qGggP5qGSctmew
Rigo S.,/user_details?userid=7Y9XevSOD0bfxzBUB7-FSQ,"New York, NY",1/5/2017,4.0,"Kiki' was actually rather difficult to find since the sign outside does not say kikis. However, the food was excellent. We order the meat plate(bunch of different meets on a tray with fries) as well as the lamb chops. The lamp chops were awesome! The wine was decent with a decent selection. Fries were awesome too. Table are rather small so when out group of six was given a table then converted a table of four for six of us so it was very tight as you can imagine. The waiters were great too. I would definitely recommend and will come back to dine again!",https://www.yelp.com/biz/kikis-new-york?adjust_creative=YOPxpPg1qGggP5qGSctmew&utm_campaign=yelp_api_v3&utm_medium=api_v3_business_search&utm_source=YOPxpPg1qGggP5qGSctmew
Ariella K.,/user_details?userid=EJQoy6cSnzuuyt3jx3eqpQ,"Los Angeles, CA",2/9/2019,4.0,"Really good food and not insanely expensive for how good it is and how much you get. It is, however, such a scene that it's sort of painful. The wait was longer than anticipated and people who knew the host kept coming in - I really wish you could just make a res. Either way, house wine was great, lemon potatoes and tzatziki were bomb, octopus and fried calamari were nice too.",https://www.yelp.com/biz/kikis-new-york?adjust_creative=YOPxpPg1qGggP5qGSctmew&utm_campaign=yelp_api_v3&utm_medium=api_v3_business_search&utm_source=YOPxpPg1qGggP5qGSctmew
Jessie D.,/user_details?userid=STuZ7NOKEQH9u6vFro6dzw,"Manhattan, NY",2/7/2019,5.0,"Delicious Greek food. Went with a group of 4 friends and we shared Mama's roasted chicken, grilled Octopus, Moussaka, and Pastitchio. Each dish was spectacular. Mama's roasted chicken came with a savory, rich, and lemon-y sauce that worked beautifully with the tender potatoes and chicken -- trust me, the lemon worked well as it brought a certain tang and sourness to the sauce. The grilled octopus slices was infused with delicious oils and juices and was very tender. I never had moussaka nor Pastitchio before but I would definitely get it again -- it certainly rivals Italian pasta. First experience with Greek food and it definitely has me hooked.",https://www.yelp.com/biz/kikis-new-york?adjust_creative=YOPxpPg1qGggP5qGSctmew&utm_campaign=yelp_api_v3&utm_medium=api_v3_business_search&utm_source=YOPxpPg1qGggP5qGSctmew
Samuele M.,/user_details?userid=zzd9s-o8jN58e_M4pYb85w,"Menlo Park, CA",6/24/2017,5.0,Best Greek food I had in a long long time. The octopus was spectacular. Good wine. Excellent location and service.,https://www.yelp.com/biz/kikis-new-york?adjust_creative=YOPxpPg1qGggP5qGSctmew&utm_campaign=yelp_api_v3&utm_medium=api_v3_business_search&utm_source=YOPxpPg1qGggP5qGSctmew
Calvin S.,/user_details?userid=Z01Jn25ktw8VA_sCFjduEQ,"Closter, NJ",2/5/2019,5.0,Best greek place ever. Vibe and food was good and never been to greece but seem v authentic to me lol,https://www.yelp.com/biz/kikis-new-york?adjust_creative=YOPxpPg1qGggP5qGSctmew&utm_campaign=yelp_api_v3&utm_medium=api_v3_business_search&utm_source=YOPxpPg1qGggP5qGSctmew
Jennings C.,/user_details?userid=s347HiPnctf1PVPc7t7vAQ,"Charleston, SC",1/31/2016,5.0,"This is the china town gem you never knew existed. Some of the best no fuss, authentic Greek food we've had in New York. The mixed meat plate seems as though it's from an old Greek family recipe. The house white wine is Delish and they serve in aluminum carafes. Just a lovely lovely experience we will be back. Only tip is to get there early!",https://www.yelp.com/biz/kikis-new-york?adjust_creative=YOPxpPg1qGggP5qGSctmew&utm_campaign=yelp_api_v3&utm_medium=api_v3_business_search&utm_source=YOPxpPg1qGggP5qGSctmew
Mary L.,/user_details?userid=9aw6JQ2oTF0a3HrqoiT98w,"Brooklyn, NY",11/1/2016,3.0,"Affordable, tasty greek food. Had no complaints. Nice + moody at night which could be good for dates.",https://www.yelp.com/biz/kikis-new-york?adjust_creative=YOPxpPg1qGggP5qGSctmew&utm_campaign=yelp_api_v3&utm_medium=api_v3_business_search&utm_source=YOPxpPg1qGggP5qGSctmew
Sam C.,/user_details?userid=XEo3h2Pbh0y2RtCMiUW67w,"Brooklyn, NY",10/31/2016,5.0,"Had the fried calamari, octopus and mixed grilled meat platter from KiKi's, a Greek restaurant in lower Manhattan. One of the few in the area of East Broadway chinatown. Been dying to try this place out! Definitely delivered, reasonable priced as well. Will be back in the future",https://www.yelp.com/biz/kikis-new-york?adjust_creative=YOPxpPg1qGggP5qGSctmew&utm_campaign=yelp_api_v3&utm_medium=api_v3_business_search&utm_source=YOPxpPg1qGggP5qGSctmew
glyn J.,/user_details?userid=cl9PfbrH33h3k2WHxW5q-Q,"New York, NY",1/25/2017,5.0,"Easy to walk by this place with a cool old sign of the previous biz, love the ambiance and interesting location. The food was amazing! Starting with the saganaki, which was wrapped in phyla and drizzled with honey! Next, spinach pie..yes please...was seemingly baked in a pan rather than the traditional triangle. Octopus!! Totally delicious and tender. Lemon potatoes...perfectly cooked and lemony (I personally like mine more well done and crispy, but these were great!). Last but not least...the zucchini chips...I would go back just for them!! A big basket of paper thin zucchini gently fried and sprinkled with cheese! So good!! Service was fantastic and the place super low key. You need to go to here now!!",https://www.yelp.com/biz/kikis-new-york?adjust_creative=YOPxpPg1qGggP5qGSctmew&utm_campaign=yelp_api_v3&utm_medium=api_v3_business_search&utm_source=YOPxpPg1qGggP5qGSctmew
Michael R.,/user_details?userid=Xv4bMues9O-xoFoOrsgThg,"Williamsburg, VA",3/28/2019,1.0,"Waited in line and the waitress looked at me then took 3 peoples names down in front of me. When she got to me and I asked how long it would be and told her I had been there before the 3 previous parties she told me to ""speak up next time."" The food may be good but service is shit.",https://www.yelp.com/biz/kikis-new-york?adjust_creative=YOPxpPg1qGggP5qGSctmew&utm_campaign=yelp_api_v3&utm_medium=api_v3_business_search&utm_source=YOPxpPg1qGggP5qGSctmew
Gianna S.,/user_details?userid=kRTPmsfOPrDGdaZIPcrQXg,"New York, NY",5/21/2018,1.0,"I was extremely excited to try Kiki's after all the good reviews I read. We came on a Sunday night four girls and had to wait around 25 minutes. there was a line out the door but they said they'd call us when our table was ready. The wait was way less than she had indicated (45 min). The ambiance was extremely cute, almost cave like with 3 different sections of the restaurant and tables right in windows over the street. Aside from the ambiance, there was a lot left to be desired. We started out with the tzakziki, which was ok- probably the best thing. We then ordered what they said was like hummus, I think the fava dip. This was possibly the most disgusting hummus I've ever had. It was chalky and terrible tasting, no flavor. We also got the moussaka. This was also disgusting. It was smothered in some sort of cheese. We then got the octopus which was nothing special- straight octopus all minced up which was strange. The spanakopita was the only edible thing we ordered besides the tzakziki. Last we got the zucchini chips, which were way too fried for my liking. The service was slow we had to ask for help multiple times and the woman would not answer our questions about the menu. The only good thing was the wine- which was fairly inexpensive for a carafe (around 25). The prices were good, as was the ambiance but the food was definitely not up to par and not what we expected.",https://www.yelp.com/biz/kikis-new-york?adjust_creative=YOPxpPg1qGggP5qGSctmew&utm_campaign=yelp_api_v3&utm_medium=api_v3_business_search&utm_source=YOPxpPg1qGggP5qGSctmew
Sasha A.,/user_details?userid=0ldLag04y4AFMVTj5znJ4w,"Manhattan, NY",5/20/2017,5.0,No comment,https://www.yelp.com/biz/kikis-new-york?adjust_creative=YOPxpPg1qGggP5qGSctmew&utm_campaign=yelp_api_v3&utm_medium=api_v3_business_search&utm_source=YOPxpPg1qGggP5qGSctmew
Caitlin J.,/user_details?userid=vhFtUxDZVhFIEom3KCQq7g,"Brooklyn, NY",5/16/2017,5.0,"One of my favorite places to eat in the city. The Greek salad is delicious, as is the biftecki, the bread... and everything else.",https://www.yelp.com/biz/kikis-new-york?adjust_creative=YOPxpPg1qGggP5qGSctmew&utm_campaign=yelp_api_v3&utm_medium=api_v3_business_search&utm_source=YOPxpPg1qGggP5qGSctmew
V M.,/user_details?userid=hYKxkZM1Okcwa6NBexktNw,"Boston, MA",5/10/2017,5.0,No comment,https://www.yelp.com/biz/kikis-new-york?adjust_creative=YOPxpPg1qGggP5qGSctmew&utm_campaign=yelp_api_v3&utm_medium=api_v3_business_search&utm_source=YOPxpPg1qGggP5qGSctmew
K D.,/user_details?userid=pCgcJWfZo4UbIRvt_d1R4A,"White Plains, NY",5/3/2017,4.0,"Unexpected tasty Greek in Chinatown! Got really hungry as we were walking around and had a late lunch...no sign but Kyknos empty tomato cans used to hold utensils and Kalas salt gave it away. We had spanakopita, grilled octopus, loukaniko  (sausage) with orange and horiatiki salad...nice server. As Greeks we would recommend it.",https://www.yelp.com/biz/kikis-new-york?adjust_creative=YOPxpPg1qGggP5qGSctmew&utm_campaign=yelp_api_v3&utm_medium=api_v3_business_search&utm_source=YOPxpPg1qGggP5qGSctmew
Loukas P.,/user_details?userid=_eyWKoKpLhLCymCpJBEnWw,"Knoxville, TN",2/17/2017,2.0,"This place used to be very very good, but not anymore. It's overrated now. The food is average or bad and not work the wait",https://www.yelp.com/biz/kikis-new-york?adjust_creative=YOPxpPg1qGggP5qGSctmew&utm_campaign=yelp_api_v3&utm_medium=api_v3_business_search&utm_source=YOPxpPg1qGggP5qGSctmew
Ray S.,/user_details?userid=fCiMsi_6Rzf0bsILvLxzOw,"Wayne, NJ",9/11/2016,4.0,We sat in the private room.  The server was a very friendly and helpful gentleman.  The tzatziki sauce was very good.  I loved the spicy cheese.  The grilled octopus and Kiki's Kayanas were superb.  Kiki's Kyanas was a kitchen sink type dish that everyone loved.  Well worth a visit.,https://www.yelp.com/biz/kikis-new-york?adjust_creative=YOPxpPg1qGggP5qGSctmew&utm_campaign=yelp_api_v3&utm_medium=api_v3_business_search&utm_source=YOPxpPg1qGggP5qGSctmew
Alivia D.,/user_details?userid=LpjWwovmr3sBu6Wi9PBP_A,"New York, NY",11/2/2015,5.0,"Kiki's was lovely. The service was so friendly and accommodating, the food is delicious and the vibe is so cozy. The octopus is amazing - lemony, tender and charred. Super creamy tzatziki. The Briami is an amazing veggie option that even meat-lovers will enjoy! Going back asap to try the desserts :)",https://www.yelp.com/biz/kikis-new-york?adjust_creative=YOPxpPg1qGggP5qGSctmew&utm_campaign=yelp_api_v3&utm_medium=api_v3_business_search&utm_source=YOPxpPg1qGggP5qGSctmew
Dennis L.,/user_details?userid=QB7DYCKfajkQbws6_tbgMQ,"Manhattan, New York, NY",5/6/2019,5.0,Great authentic Greek food. I like that pastry with cheese and honey and the orange Greek wine. It's always busy and they don't have a sign,https://www.yelp.com/biz/kikis-new-york?adjust_creative=YOPxpPg1qGggP5qGSctmew&utm_campaign=yelp_api_v3&utm_medium=api_v3_business_search&utm_source=YOPxpPg1qGggP5qGSctmew
Carlos C.,/user_details?userid=gkYVqQQCIlbNDg6D-OZBGQ,"San Francisco, CA",4/13/2017,5.0,"love this place! Been several times and always eat well. There's a good, laid back vibe. Don't think you can go wrong with what you order, but the spanakopita and lamb were especially good!",https://www.yelp.com/biz/kikis-new-york?adjust_creative=YOPxpPg1qGggP5qGSctmew&utm_campaign=yelp_api_v3&utm_medium=api_v3_business_search&utm_source=YOPxpPg1qGggP5qGSctmew
David B.,/user_details?userid=i1Vhu64KRsW7YvdKAFNzEA,"San Francisco, CA",7/6/2016,2.0,"Overrated. It was fine but in no way blew my mind. Eggplant mezze was nice. Everything else mediocre: branzino, grilled octopus, fava spread...",https://www.yelp.com/biz/kikis-new-york?adjust_creative=YOPxpPg1qGggP5qGSctmew&utm_campaign=yelp_api_v3&utm_medium=api_v3_business_search&utm_source=YOPxpPg1qGggP5qGSctmew
Allison C.,/user_details?userid=-z7bz5yjJnugQDjX4dN2dg,"Brooklyn, NY",4/3/2017,5.0,"Such a treat. Went with a big group (not the kinda place you should take a big group, its cavernous and there is always a wait) and they were SUPER accommodating. They helped pick just the right amount of food, didn't rush us at all, and were completely lovely. It was also very affordable for the amount of eating and drinking we did. Everyone consumed pretty heartily, and it was less than $60 a person. Which is kind pretty great considering its NYC and we had 3 bottles of wine. Will definitely be going back!",https://www.yelp.com/biz/kikis-new-york?adjust_creative=YOPxpPg1qGggP5qGSctmew&utm_campaign=yelp_api_v3&utm_medium=api_v3_business_search&utm_source=YOPxpPg1qGggP5qGSctmew
Kerrie T.,/user_details?userid=A6n0ziuHvlvbc5NrKc646Q,"New York, NY",10/1/2015,5.0,Came in for lunch with a group and sampled half the menu. This little hidden spot at the end of orchard street at Division is endearingly charming! I loved every bite of this home style Greek food. The staff was also very attentive and sweet. Definitely coming back for dinner as just hop skip and jump from home by bikes.,https://www.yelp.com/biz/kikis-new-york?adjust_creative=YOPxpPg1qGggP5qGSctmew&utm_campaign=yelp_api_v3&utm_medium=api_v3_business_search&utm_source=YOPxpPg1qGggP5qGSctmew
Ariel S.,/user_details?userid=xO_YUV7z1Ld49sjCTYgujw,"Brooklyn, NY",9/19/2016,5.0,No comment,https://www.yelp.com/biz/kikis-new-york?adjust_creative=YOPxpPg1qGggP5qGSctmew&utm_campaign=yelp_api_v3&utm_medium=api_v3_business_search&utm_source=YOPxpPg1qGggP5qGSctmew
