Rodney G.,/user_details?userid=mD8Ek9bYFm8yjZmzwdISOg,"Manhattan, New York, NY",4/8/2019,5.0,"A very small but great sushi joint. It us a hole-in-the-wall and hard to notice besides their white sushi sign. I tried the Ninja Yummy Stick and it was and is probably one of the best sushi rolls I have ever had. Ordering and making it was quick. The worker is very nice and always cleans the station when he needs to make another order for someone. The Ninja stick has spicy tuna, shrimp tempura, teriyaki sauce, egg, avocado and some kind of mayo. I was not expecting it to be as amazing and big as it was. While it is $12, the roll is the size of a hero sandwich like a big sushi burrito. The flavor itself was amazing and felt like I was trying multiple things at once from the tuna to the teriyaki and mayo and just everything else. All of it together is packed so well. Not only is it worth the price and the time, it is worth every bite.",https://www.yelp.com/biz/maru-2-new-york-4?adjust_creative=YOPxpPg1qGggP5qGSctmew&utm_campaign=yelp_api_v3&utm_medium=api_v3_business_search&utm_source=YOPxpPg1qGggP5qGSctmew
Jocelyn K.,/user_details?userid=DC1hfeeSaYr2E1xwiEL81A,"Queens, NY",11/25/2015,5.0,No comment,https://www.yelp.com/biz/maru-2-new-york-4?adjust_creative=YOPxpPg1qGggP5qGSctmew&utm_campaign=yelp_api_v3&utm_medium=api_v3_business_search&utm_source=YOPxpPg1qGggP5qGSctmew
Zach L.,/user_details?userid=ZIOc_F7o6DzVLJjJ8AFq1Q,"Brooklyn, NY",2/19/2020,5.0,"Maru 2 is amazing!! It's tiny, a real hole in the wall. The sushi burrito is fresh, delicious, and truly affordable for the city. The man behind the counter is super friendly and fast. The place was full (6 people) and it only took 3 minutes for him to make my meal. Definitely recommend!",https://www.yelp.com/biz/maru-2-new-york-4?adjust_creative=YOPxpPg1qGggP5qGSctmew&utm_campaign=yelp_api_v3&utm_medium=api_v3_business_search&utm_source=YOPxpPg1qGggP5qGSctmew
Samanyha O.,/user_details?userid=nunDTzJU51w5T6txEeUYjA,"New York, NY",11/4/2019,5.0,Wonderful quick and easy lunch. This place is small and very cozy. You are served quickly and all the ingredients are really fresh. I would recommend this place to anyone who's looking for a yummy lunch that won't break the budget. Can't wait to come back!,https://www.yelp.com/biz/maru-2-new-york-4?adjust_creative=YOPxpPg1qGggP5qGSctmew&utm_campaign=yelp_api_v3&utm_medium=api_v3_business_search&utm_source=YOPxpPg1qGggP5qGSctmew
Anna C.,/user_details?userid=yufKqYSRkyCJLObBW8ARQw,"Forest Hills, Queens, NY",10/8/2017,5.0,"Great for a quick and affordable meal! I ordered the yummy stick with avocado and fried tempura and it was very satisfying! The service is always great, and you can order before through yelp for an easy pick up. Space is limited inside, so it's best for something quick and convenient.",https://www.yelp.com/biz/maru-2-new-york-4?adjust_creative=YOPxpPg1qGggP5qGSctmew&utm_campaign=yelp_api_v3&utm_medium=api_v3_business_search&utm_source=YOPxpPg1qGggP5qGSctmew
Elton W.,/user_details?userid=KF5TkZRP2lWigBVigLEQAA,"New York, NY",6/20/2015,3.0,No comment,https://www.yelp.com/biz/maru-2-new-york-4?adjust_creative=YOPxpPg1qGggP5qGSctmew&utm_campaign=yelp_api_v3&utm_medium=api_v3_business_search&utm_source=YOPxpPg1qGggP5qGSctmew
Suanne L.,/user_details?userid=dMbMRfmX5AApq-9ZvWjdrA,"Brooklyn, NY",12/9/2011,4.0,No comment,https://www.yelp.com/biz/maru-2-new-york-4?adjust_creative=YOPxpPg1qGggP5qGSctmew&utm_campaign=yelp_api_v3&utm_medium=api_v3_business_search&utm_source=YOPxpPg1qGggP5qGSctmew
George A.,/user_details?userid=Q775oNsqEfoHn_2BghKVPw,"New York, NY",4/26/2018,5.0,Randomly stopped here and plesantly suprised!  I got the Spam Sushi Burrito and the California Sushi Burrito. Both were inexpensive and YUMMY.  Very very kind owners.  I'll be back!  Food was made quickly.,https://www.yelp.com/biz/maru-2-new-york-4?adjust_creative=YOPxpPg1qGggP5qGSctmew&utm_campaign=yelp_api_v3&utm_medium=api_v3_business_search&utm_source=YOPxpPg1qGggP5qGSctmew
Tanya C.,/user_details?userid=doAIRq-prtU4cuEFasIBbg,"Manhattan, NY",10/30/2019,5.0,Amazing! Will be going back again and again... and again. So fresh and delicious! I had the spicy salmon yummy stick. Can't wait to eat my way through the menu!,https://www.yelp.com/biz/maru-2-new-york-4?adjust_creative=YOPxpPg1qGggP5qGSctmew&utm_campaign=yelp_api_v3&utm_medium=api_v3_business_search&utm_source=YOPxpPg1qGggP5qGSctmew
Jun H.,/user_details?userid=iSXLkuyi6z1bY7tJhJvBmg,"Chicago, IL",8/4/2017,5.0,"Not really for a nice sit down meal, but yummy and affordable food. Great for take out or quick bite if you are in the area. I got the yummy stick with added avocado and it's bomb",https://www.yelp.com/biz/maru-2-new-york-4?adjust_creative=YOPxpPg1qGggP5qGSctmew&utm_campaign=yelp_api_v3&utm_medium=api_v3_business_search&utm_source=YOPxpPg1qGggP5qGSctmew
Trevor W.,/user_details?userid=RfkVLj2ShICIDMaFA4Afiw,"Queens, NY",1/31/2018,5.0,No comment,https://www.yelp.com/biz/maru-2-new-york-4?adjust_creative=YOPxpPg1qGggP5qGSctmew&utm_campaign=yelp_api_v3&utm_medium=api_v3_business_search&utm_source=YOPxpPg1qGggP5qGSctmew
Pedro K.,/user_details?userid=sD-Fv39R2RrXqgQgPgJdgw,"Seattle, WA",5/1/2017,4.0,No comment,https://www.yelp.com/biz/maru-2-new-york-4?adjust_creative=YOPxpPg1qGggP5qGSctmew&utm_campaign=yelp_api_v3&utm_medium=api_v3_business_search&utm_source=YOPxpPg1qGggP5qGSctmew
Jianne L.,/user_details?userid=92J_COR80vlu9ON-i8-YYA,"Redmond, WA",10/4/2019,5.0,"Agree with all the reviews, the couple is ridiculously nice, yummy stick is yummy but don't expect anything that would blow your mind, but don't get me wrong, it tastes good!  It's a perfect lunch which is filling cheap and makes your stomach happy. I would continue to come just to support the small business :)",https://www.yelp.com/biz/maru-2-new-york-4?adjust_creative=YOPxpPg1qGggP5qGSctmew&utm_campaign=yelp_api_v3&utm_medium=api_v3_business_search&utm_source=YOPxpPg1qGggP5qGSctmew
H C.,/user_details?userid=Q_xp4HJSPvyv7AOnetmjfw,"New York, NY",8/21/2016,5.0,No comment,https://www.yelp.com/biz/maru-2-new-york-4?adjust_creative=YOPxpPg1qGggP5qGSctmew&utm_campaign=yelp_api_v3&utm_medium=api_v3_business_search&utm_source=YOPxpPg1qGggP5qGSctmew
Katy D.,/user_details?userid=SIhlCVfJ2xssSipoUwsy4Q,"Ponderay, ID",9/29/2019,5.0,The Salmon Yummy Stick was the best $9 spent during our visit to NYC. Yummy is right!!,https://www.yelp.com/biz/maru-2-new-york-4?adjust_creative=YOPxpPg1qGggP5qGSctmew&utm_campaign=yelp_api_v3&utm_medium=api_v3_business_search&utm_source=YOPxpPg1qGggP5qGSctmew
kelly m.,/user_details?userid=FTT4zffkLUgKKSyKvOBA4g,"Bronx, NY",6/29/2017,3.0,No comment,https://www.yelp.com/biz/maru-2-new-york-4?adjust_creative=YOPxpPg1qGggP5qGSctmew&utm_campaign=yelp_api_v3&utm_medium=api_v3_business_search&utm_source=YOPxpPg1qGggP5qGSctmew
Maxine E.,/user_details?userid=D42Ni2b7v-ylUdP2ubgAmQ,"Manhattan, New York, NY",7/24/2019,5.0,"This place is so delicious and the man who works here is so sweet. The price is awesome and everything tasted really fresh. He was quick and efficient and even apologized to me for having to wait when i had been there for no more than 10 minutes, hardly a wait!! Will for sure be back",https://www.yelp.com/biz/maru-2-new-york-4?adjust_creative=YOPxpPg1qGggP5qGSctmew&utm_campaign=yelp_api_v3&utm_medium=api_v3_business_search&utm_source=YOPxpPg1qGggP5qGSctmew
Lucas R.,/user_details?userid=mlV3VdsayUxIyjNqweRSyA,"Marina del Rey, CA",9/7/2016,5.0,No comment,https://www.yelp.com/biz/maru-2-new-york-4?adjust_creative=YOPxpPg1qGggP5qGSctmew&utm_campaign=yelp_api_v3&utm_medium=api_v3_business_search&utm_source=YOPxpPg1qGggP5qGSctmew
Jordan S.,/user_details?userid=6gCLKRLX-PBBhhUQPsAzmw,"Fairfax, VA",6/25/2019,5.0,Sushi burritos were made with great ingredients and satisfied hunger for pretty cheap. Biggest selling point was that the owner was very kind. Hope for him to open a bigger restaurant in the near future.,https://www.yelp.com/biz/maru-2-new-york-4?adjust_creative=YOPxpPg1qGggP5qGSctmew&utm_campaign=yelp_api_v3&utm_medium=api_v3_business_search&utm_source=YOPxpPg1qGggP5qGSctmew
Milind S.,/user_details?userid=qJzofeJO2w3GqDoBpxUIbA,"Canyon Country, CA",3/1/2016,5.0,No comment,https://www.yelp.com/biz/maru-2-new-york-4?adjust_creative=YOPxpPg1qGggP5qGSctmew&utm_campaign=yelp_api_v3&utm_medium=api_v3_business_search&utm_source=YOPxpPg1qGggP5qGSctmew
Michael R.,/user_details?userid=L4yJbDa1KWTzaYVDNK8FRA,"Manhattan, NY",3/10/2016,5.0,No comment,https://www.yelp.com/biz/maru-2-new-york-4?adjust_creative=YOPxpPg1qGggP5qGSctmew&utm_campaign=yelp_api_v3&utm_medium=api_v3_business_search&utm_source=YOPxpPg1qGggP5qGSctmew
Chantale S.,/user_details?userid=TTJ1bQYEQFSRihAYHehyjA,"Brooklyn, NY",1/3/2019,5.0,I'm now a regular! I order through yelp for pickup and they greet me as soon as I walk through the door :) Food is delicious and affordable. A hidden gem in NYC.,https://www.yelp.com/biz/maru-2-new-york-4?adjust_creative=YOPxpPg1qGggP5qGSctmew&utm_campaign=yelp_api_v3&utm_medium=api_v3_business_search&utm_source=YOPxpPg1qGggP5qGSctmew
Gabi C.,/user_details?userid=4uS9lsKtjlCTZbXzaVXtlA,"Brooklyn, Brooklyn, NY",11/15/2020,5.0,this place is a gem my high school was right next to it and we always got lunch here. i had to bump onto ppl i hated but it was so worth the food lol :-),https://www.yelp.com/biz/maru-2-new-york-4?adjust_creative=YOPxpPg1qGggP5qGSctmew&utm_campaign=yelp_api_v3&utm_medium=api_v3_business_search&utm_source=YOPxpPg1qGggP5qGSctmew
Tiffani N.,/user_details?userid=l7Sc4vyl-wtgoy7p6IbZ9Q,"Jericho, NY",2/26/2020,4.0,Reasonable prices and the original stick is yummy! I also got the shumai which I liked! Definitely coming back  here!!,https://www.yelp.com/biz/maru-2-new-york-4?adjust_creative=YOPxpPg1qGggP5qGSctmew&utm_campaign=yelp_api_v3&utm_medium=api_v3_business_search&utm_source=YOPxpPg1qGggP5qGSctmew
Nicole L.,/user_details?userid=sIGMpdso22RAFl1fIjkJ_A,"New York, NY",8/31/2018,5.0,Tiny takeout Japanese/Korean-style food place. Super cheap rolls that are like kimbap rolls with sashimi inside. The owner is a suuuuper sweet man! Coming here makes me happy. I wish they were open weekends but he deserves that time to himself :),https://www.yelp.com/biz/maru-2-new-york-4?adjust_creative=YOPxpPg1qGggP5qGSctmew&utm_campaign=yelp_api_v3&utm_medium=api_v3_business_search&utm_source=YOPxpPg1qGggP5qGSctmew
Simon Z.,/user_details?userid=6xjgP7NIqabtxJmPEtb43A,"Manhattan, NY",5/12/2015,5.0,No comment,https://www.yelp.com/biz/maru-2-new-york-4?adjust_creative=YOPxpPg1qGggP5qGSctmew&utm_campaign=yelp_api_v3&utm_medium=api_v3_business_search&utm_source=YOPxpPg1qGggP5qGSctmew
Valerie V.,/user_details?userid=pJALqPYTjzoV9xpd34WB6g,"Los Angeles, CA",8/20/2010,2.0,No comment,https://www.yelp.com/biz/maru-2-new-york-4?adjust_creative=YOPxpPg1qGggP5qGSctmew&utm_campaign=yelp_api_v3&utm_medium=api_v3_business_search&utm_source=YOPxpPg1qGggP5qGSctmew
Rachel F.,/user_details?userid=kVw4R77kl2j_XIxevEkuew,"Manhattan, NY",8/14/2017,5.0,"Awesome lunch spot!! Favorite place to grab fresh, delicious, affordable, healthy ""sushi burrito"" on the go.",https://www.yelp.com/biz/maru-2-new-york-4?adjust_creative=YOPxpPg1qGggP5qGSctmew&utm_campaign=yelp_api_v3&utm_medium=api_v3_business_search&utm_source=YOPxpPg1qGggP5qGSctmew
Carrie Z.,/user_details?userid=P8FrVYD0JI3BKijM2Kr2Lg,"Brooklyn, NY",7/30/2018,5.0,"A nice small place for people who are looking for a quick lunch! The place is not for dining but rather for take-out. All the items here can be eaten on-the-go or really fast. I got the happy stick for $5. The ingredients are not extraordinary; in fact, you can make this at home if you wanted to. But the convenience of it and the location of the place contributes to the price, I guess. I would definitely come back if I needed something to eat really quickly. The man inside was really nice and he even explained how I should rip the aluminum foil.",https://www.yelp.com/biz/maru-2-new-york-4?adjust_creative=YOPxpPg1qGggP5qGSctmew&utm_campaign=yelp_api_v3&utm_medium=api_v3_business_search&utm_source=YOPxpPg1qGggP5qGSctmew
Cub B.,/user_details?userid=nbYuksJrYjCdKlL6VhjZEQ,"New York, NY",4/5/2018,5.0,"Excellent quick lunch for pick up. The owners are the NICEST people ever. It is a joy coming here, both for the food and for the service.",https://www.yelp.com/biz/maru-2-new-york-4?adjust_creative=YOPxpPg1qGggP5qGSctmew&utm_campaign=yelp_api_v3&utm_medium=api_v3_business_search&utm_source=YOPxpPg1qGggP5qGSctmew
Bin H.,/user_details?userid=aC7wx9w95dIi1p2z0d0weg,"Downtown, Los Angeles, CA",4/19/2013,4.0,No comment,https://www.yelp.com/biz/maru-2-new-york-4?adjust_creative=YOPxpPg1qGggP5qGSctmew&utm_campaign=yelp_api_v3&utm_medium=api_v3_business_search&utm_source=YOPxpPg1qGggP5qGSctmew
Taylor F.,/user_details?userid=nKOLWqpue3vmlwAdUQ6S0w,"Brooklyn, NY",8/4/2017,5.0,"I work in the area and this is my go to spot. $5 you can eat well $10 you eat like a king! The guy working there is incredibly nice too! Tiny walk in place w/ 3 stools so I'd recommend taking it out. Classic yummi stick, add avocado and you're set.",https://www.yelp.com/biz/maru-2-new-york-4?adjust_creative=YOPxpPg1qGggP5qGSctmew&utm_campaign=yelp_api_v3&utm_medium=api_v3_business_search&utm_source=YOPxpPg1qGggP5qGSctmew
Amy G.,/user_details?userid=eMCTaJpOcVx701hf-GkIJw,"San Francisco, CA",7/29/2012,5.0,No comment,https://www.yelp.com/biz/maru-2-new-york-4?adjust_creative=YOPxpPg1qGggP5qGSctmew&utm_campaign=yelp_api_v3&utm_medium=api_v3_business_search&utm_source=YOPxpPg1qGggP5qGSctmew
Michael D.,/user_details?userid=g9tx2jLn7THs74rvRUYGyg,"Oakland Gardens, NY",7/23/2017,5.0,"Really loved the sushi and Kimbap rolls. They sell it to you in like one big roll, no cuts like a burrito. Super tasty as a snack or as a meal depending on your appetite. Dip it in some soy sauce and you'll get a mouth watering Asian styled meal. Owner was super nice and has a great smile on all the time. He even has a painted portrait of himself super cool, not obnoxious lol.",https://www.yelp.com/biz/maru-2-new-york-4?adjust_creative=YOPxpPg1qGggP5qGSctmew&utm_campaign=yelp_api_v3&utm_medium=api_v3_business_search&utm_source=YOPxpPg1qGggP5qGSctmew
Carol M.,/user_details?userid=KEDQKifzVF3AswibNYhBXA,"Brooklyn, NY",11/6/2019,5.0,"Amazing service and incredibly delicious! I came here on a Monday afternoon about 30 mins to closing time. I was in the area and had this place bookmarked so I decided why not come give it a try? Well, that was the best decision I made all week. I was greeted by a gentleman (I assume he is the owner) behind the counter who was very friendly and understanding. After I placed my order, he went straight to making the Yummy stick and the spicy tuna roll. I didn't expect to like the spicy tuna roll but it was actually very flavorful! The egg in both of the rolls were the perfect touch as well. Definitely satisfied my sushi/kimbap craving! Most definitely will come back again!!",https://www.yelp.com/biz/maru-2-new-york-4?adjust_creative=YOPxpPg1qGggP5qGSctmew&utm_campaign=yelp_api_v3&utm_medium=api_v3_business_search&utm_source=YOPxpPg1qGggP5qGSctmew
Gianni L.,/user_details?userid=xlVer74RewrRmnLqK79Q3A,"New York, NY",6/7/2017,5.0,"A great little stop, and a great little taste of Asia on this side of town. Fast and inexpensive, and always met with a great smile and customer service. They offer pick-up orders via Yelp too, so even more convenient! I ordered their chicken udon + sushi special was is a steal for $10... I'm full off of the noodles so I even get to keep the sushi as a snack.",https://www.yelp.com/biz/maru-2-new-york-4?adjust_creative=YOPxpPg1qGggP5qGSctmew&utm_campaign=yelp_api_v3&utm_medium=api_v3_business_search&utm_source=YOPxpPg1qGggP5qGSctmew
Dominick C.,/user_details?userid=KL-tA7nO6i6-9h4pOfjLTA,"Manhattan, NY",5/24/2018,5.0,Honestly didn't know what to expect when I got a Yummy Stick. A friend lives around the corner and has been raving endlessly about them so I had to indulge. It far exceeded my expectations! The Yummy Stick was filling and best of all only costs 5 bucks!,https://www.yelp.com/biz/maru-2-new-york-4?adjust_creative=YOPxpPg1qGggP5qGSctmew&utm_campaign=yelp_api_v3&utm_medium=api_v3_business_search&utm_source=YOPxpPg1qGggP5qGSctmew
Alex K.,/user_details?userid=yZW8QyAS76xylSC_NGF67w,"Malverne, NY",8/2/2017,5.0,"Delicious sushi at an incredibly low price. The Yummy Stick is the BEST. I eat here at least once a week because I just love to give this place my business. The owners are the sweetest people, they even sometimes offer you free miso soup when it's cold out!! Love them, love this place, would recommend 100x over.",https://www.yelp.com/biz/maru-2-new-york-4?adjust_creative=YOPxpPg1qGggP5qGSctmew&utm_campaign=yelp_api_v3&utm_medium=api_v3_business_search&utm_source=YOPxpPg1qGggP5qGSctmew
Dominique C.,/user_details?userid=kdJ1dmzyUeoh6KQDecEcSQ,"Graniteville, Staten Island, NY",6/7/2018,5.0,"This place is a lovely tiny spot with amazing little treasures. The price is very inexpensive and very fair, especially for the area. While I sat at the one person ""table"" (which was a stool and a ledge) and is the only seating... this is obviously a takeout place, there was a steady stream of regulars that came in and out. The proprietor was very friendly and you could tell when someone had come back more than once. He even remembered some preferred orders. He is a hard working man, and puts passion in his food creations. The most popular food were the ""Yummy Sticks"" which are essentially thin sushi burritos that you unroll from foil and bite. I will be returning to this place if I'm in the area. I'd say that it'd be better to have more space and have customers sit and eat, but that's the magic of their inexpensiveness, any larger and the overhead would be too much.",https://www.yelp.com/biz/maru-2-new-york-4?adjust_creative=YOPxpPg1qGggP5qGSctmew&utm_campaign=yelp_api_v3&utm_medium=api_v3_business_search&utm_source=YOPxpPg1qGggP5qGSctmew
Scott L.,/user_details?userid=ePRXhSkWhTpLGRL-TVz71w,"Houston, TX",5/13/2018,5.0,"Super friendly owner, delicious and healthy food, great price. The only downside is their limited hours.",https://www.yelp.com/biz/maru-2-new-york-4?adjust_creative=YOPxpPg1qGggP5qGSctmew&utm_campaign=yelp_api_v3&utm_medium=api_v3_business_search&utm_source=YOPxpPg1qGggP5qGSctmew
David S.,/user_details?userid=ns9n02iLn3UjCA3Ds8CTFw,"East Fort Lauderdale, Fort Lauderdale, FL",9/28/2019,4.0,Grabbed a late lunch on Friday. Enjoyed the spicy tuna stick. Basically it's a Japanese burrito. Very tasty. My wife had the soup. It was a bit salty but the noodles were good.,https://www.yelp.com/biz/maru-2-new-york-4?adjust_creative=YOPxpPg1qGggP5qGSctmew&utm_campaign=yelp_api_v3&utm_medium=api_v3_business_search&utm_source=YOPxpPg1qGggP5qGSctmew
Diana L.,/user_details?userid=VGXo-nI41rKIQrEL-p_WFg,"Newark, NJ",9/6/2016,5.0,"Great place. It's a tiny hole in the wall kind of place with great takeout. I got the udon and asked for it to be made spicy. It was delicious. I also got the spicy tuna, the roll wasn't the prettiest but tasted great. My SO got the yummy spicy tuna roll, it was so refreshing. All together, love this place. The gentleman making the food was so kind and careful with how he packed all my soups so they wouldn't spill which was helpful because I made a stop to the post office before heading home. Everything came out to under $20. Awesomeness.",https://www.yelp.com/biz/maru-2-new-york-4?adjust_creative=YOPxpPg1qGggP5qGSctmew&utm_campaign=yelp_api_v3&utm_medium=api_v3_business_search&utm_source=YOPxpPg1qGggP5qGSctmew
Ashley D.,/user_details?userid=6WFonS1ehpnk_OIvOVQaAA,"Chicago, IL",9/19/2014,3.0,No comment,https://www.yelp.com/biz/maru-2-new-york-4?adjust_creative=YOPxpPg1qGggP5qGSctmew&utm_campaign=yelp_api_v3&utm_medium=api_v3_business_search&utm_source=YOPxpPg1qGggP5qGSctmew
J.l. U.,/user_details?userid=KSehrs2Qb4Sjzjowyb9C8w,"Brooklyn, Brooklyn, NY",7/18/2019,5.0,"I have been wanting to try this place for weeks, but it's a long walk from work. Today I finally made the journey and it was definitely worth it! Delicious, filling and a super friendly owner.",https://www.yelp.com/biz/maru-2-new-york-4?adjust_creative=YOPxpPg1qGggP5qGSctmew&utm_campaign=yelp_api_v3&utm_medium=api_v3_business_search&utm_source=YOPxpPg1qGggP5qGSctmew
Allison M.,/user_details?userid=WH-HYvvBP6qh0BssvM5LaA,"New York, NY",7/18/2012,4.0,No comment,https://www.yelp.com/biz/maru-2-new-york-4?adjust_creative=YOPxpPg1qGggP5qGSctmew&utm_campaign=yelp_api_v3&utm_medium=api_v3_business_search&utm_source=YOPxpPg1qGggP5qGSctmew
Blake V.,/user_details?userid=YYJLFigixUCbEGWE-gfFbg,"Levittown, NY",4/10/2017,5.0,Limited seating but great healthy food with a great price. Perfect for lunch take out or delivery.,https://www.yelp.com/biz/maru-2-new-york-4?adjust_creative=YOPxpPg1qGggP5qGSctmew&utm_campaign=yelp_api_v3&utm_medium=api_v3_business_search&utm_source=YOPxpPg1qGggP5qGSctmew
Ellen P.,/user_details?userid=ITPU0B9Cu8PqPib4hEbp1g,"San Diego, CA",3/7/2014,4.0,No comment,https://www.yelp.com/biz/maru-2-new-york-4?adjust_creative=YOPxpPg1qGggP5qGSctmew&utm_campaign=yelp_api_v3&utm_medium=api_v3_business_search&utm_source=YOPxpPg1qGggP5qGSctmew
Rich B.,/user_details?userid=Il9EB1SLBALhvp7GOVMokw,"Brooklyn, NY",2/13/2014,4.0,No comment,https://www.yelp.com/biz/maru-2-new-york-4?adjust_creative=YOPxpPg1qGggP5qGSctmew&utm_campaign=yelp_api_v3&utm_medium=api_v3_business_search&utm_source=YOPxpPg1qGggP5qGSctmew
Chris P.,/user_details?userid=OcUwbO7hUjt-U_h6VzuwLg,"Manhattan, NY",3/21/2016,5.0,"Great value! Perfect spot to grab lunch to go. ""Mr Nice Guy"" will have you coming back!",https://www.yelp.com/biz/maru-2-new-york-4?adjust_creative=YOPxpPg1qGggP5qGSctmew&utm_campaign=yelp_api_v3&utm_medium=api_v3_business_search&utm_source=YOPxpPg1qGggP5qGSctmew
Jozefina L.,/user_details?userid=5Bu_8sn1uExNSng_ZcZgyQ,"Flushing, NY",1/20/2016,5.0,Although this place is very small it's extremely lovely!!!! The guy who works here is incredibly kind and the food is great and affordable!!,https://www.yelp.com/biz/maru-2-new-york-4?adjust_creative=YOPxpPg1qGggP5qGSctmew&utm_campaign=yelp_api_v3&utm_medium=api_v3_business_search&utm_source=YOPxpPg1qGggP5qGSctmew
Megan C.,/user_details?userid=KVyq7CI9PzOm63XW7yIPxg,"New York, NY",4/19/2017,4.0,"Wonderful service and yummy food. I was a little disappointed with the lack of vegan options for broth so I wasn't able to get the lunch special that comes with noodles, but the friendly treatment I received plus the veggie dumplings and delicious avocado rolls left me satisfied.",https://www.yelp.com/biz/maru-2-new-york-4?adjust_creative=YOPxpPg1qGggP5qGSctmew&utm_campaign=yelp_api_v3&utm_medium=api_v3_business_search&utm_source=YOPxpPg1qGggP5qGSctmew
Peter C.,/user_details?userid=EmsV1f8U1r_T3ZGc3ctrlQ,"New York, NY",12/21/2015,5.0,"Amazing little hole-in-the-wall, takeout sushi place run by an amazingly nice, friendly, and wonderful person. Unbeatable quality for the price (and also the friendliness of the owner)! My favorites are either the soba or udon noodles with shumai--which are leaps and bounds better than any equally priced restaurant in the area. If you're feeling indulgent, try the Yummy Stick, which is sort of like a sushi burrito.",https://www.yelp.com/biz/maru-2-new-york-4?adjust_creative=YOPxpPg1qGggP5qGSctmew&utm_campaign=yelp_api_v3&utm_medium=api_v3_business_search&utm_source=YOPxpPg1qGggP5qGSctmew
Cindy L.,/user_details?userid=p9aZU8a8DERGNlt2jTz7oA,"Arlington, VA",11/12/2015,5.0,"I've tried a few rolls and the yummy stick - rice burrito with Fried egg, crabmeat, Japanese mayo. It's not bad for a quick lunch place. The people are super friendly. Come here if you want to be happy.",https://www.yelp.com/biz/maru-2-new-york-4?adjust_creative=YOPxpPg1qGggP5qGSctmew&utm_campaign=yelp_api_v3&utm_medium=api_v3_business_search&utm_source=YOPxpPg1qGggP5qGSctmew
Isabella C.,/user_details?userid=Oku0QE_zh3MF-zLABqr7Zg,"Miami, FL",12/23/2015,4.0,Quick easy and delicious. What more is there to say. Udon soup is delicious and totally worth it. It is a tiny place so don't expect a restaurant it more of a to go joint but delicious. Not the beat looking but the food makes up for it,https://www.yelp.com/biz/maru-2-new-york-4?adjust_creative=YOPxpPg1qGggP5qGSctmew&utm_campaign=yelp_api_v3&utm_medium=api_v3_business_search&utm_source=YOPxpPg1qGggP5qGSctmew
Sam B.,/user_details?userid=75cdgmx6L9L_jn523K_X3Q,"Brooklyn, NY",12/11/2017,5.0,"This is not fine dining but it is a mom and pop type of eatery with the sweetest couple running it. There is barely room inside for more than 2 people to stand which is why the lines are out the door most of the time.  They have a solid udon soup and the yummy stick is an amazing deal for 5$. The sushi isn't bad either. Literal hole in the wall but great food, prices and customer service keep me going back.",https://www.yelp.com/biz/maru-2-new-york-4?adjust_creative=YOPxpPg1qGggP5qGSctmew&utm_campaign=yelp_api_v3&utm_medium=api_v3_business_search&utm_source=YOPxpPg1qGggP5qGSctmew
John H.,/user_details?userid=Fu1vXMv4NRKtZNvfmyD36g,"Fort Lee, NJ",3/21/2015,5.0,No comment,https://www.yelp.com/biz/maru-2-new-york-4?adjust_creative=YOPxpPg1qGggP5qGSctmew&utm_campaign=yelp_api_v3&utm_medium=api_v3_business_search&utm_source=YOPxpPg1qGggP5qGSctmew
Brian S.,/user_details?userid=Qa2tb_kuVoy4S6zUMYgd3A,"Manhattan, New York, NY",5/7/2008,5.0,No comment,https://www.yelp.com/biz/maru-2-new-york-4?adjust_creative=YOPxpPg1qGggP5qGSctmew&utm_campaign=yelp_api_v3&utm_medium=api_v3_business_search&utm_source=YOPxpPg1qGggP5qGSctmew
